line,au_code
"Hid from the eyes of men, that were intended",JF
To live amongst us swains.,JF
"_Cloe._ Thou art befriended,",JF
"Shepherd, in all my life I have not seen",JF
A man in whom greater contents have been,JF
"Than thou thy self art: I could tell thee more,",JF
Were there but any hope left to restore,JF
"My freedom lost. O lend me all thy red,",JF
"Thou shamefast morning, when from _Tithons_ bed",JF
Thou risest ever maiden.,JF
"_Alex. _If for me,",JF
"Thou sweetest of all sweets, these flashes be,",JF
"Speak and be satisfied. O guide her tongue,",JF
My better angel; force my name among,JF
"Her modest thoughts, that the first word may be--",JF
"_Cloe._ _Alexis_, when the sun shall kiss the Sea,",JF
"Taking his rest by the white _Thetis_ side,",JF
"Meet in the holy wood, where I'le abide",JF
"Thy coming, Shepherd.",JF
"_Alex._ If I stay behind,",JF
"An everlasting dulness, and the wind,",JF
That as he passeth by shuts up the stream,JF
"Of _Rhine_ or _Volga_, whilst the suns hot beam",JF
"Beats back again, seise me, and let me turn",JF
To coldness more than ice: oh how I burn,JF
And rise in youth and fire! I dare not stay.,JF
_Cloe._ My name shall be your word.,JF
"_Alex._ Fly, fly thou day.                        [_Exit._",JF
_Cloe._ My grief is great if both these boyes should fail:,JF
He that will use all winds must shift his sail.        [_Exit._,JF
_Actus Secundus. Scena Prima._,JF
"_Enter an old_ Shepherd, _with a bell ringing, and the Priest of Pan",JF
following._,JF
"_Priest._  O Shepherds all, and maidens fair,",JF
"Fold your flocks up, for the Air",JF
"Gins to thicken, and the sun",JF
Already his great course hath run.,JF
See the dew-drops how they kiss,JF
Every little flower that is:,JF
"Hanging on their velvet heads,",JF
Like a rope of crystal beads.,JF
"See the heavy clouds low falling,",JF
And bright _Hesperus_ down calling,JF
"The dead night from under ground,",JF
"At whose rising mists unsound,",JF
"Damps, and vapours fly apace,",JF
Hovering o're the wanton face,JF
"Of these pastures, where they come,",JF
Striking dead both bud and bloom;,JF
Therefore from such danger lock,JF
"Every one his loved flock,",JF
"And let your Dogs lye loose without,",JF
Lest the Wolf come as a scout,JF
"From the mountain, and e're day",JF
"Bear a Lamb or kid away,",JF
"Or the crafty theevish Fox,",JF
Break upon your simple flocks:,JF
"To secure your selves from these,",JF
Be not too secure in ease;,JF
"Let one eye his watches keep,",JF
Whilst the t'other eye doth sleep;,JF
"So you shall good Shepherds prove,",JF
And for ever hold the love,JF
Of our great god. Sweetest slumbers,JF
And soft silence fall in numbers,JF
"On your eye-lids: so farewel,",JF
Thus I end my evenings knel.                    [_Exeunt._,JF
"_Enter_ Clorin, _the_ Shepherdess, _sorting of herbs, and telling the",JF
natures of them._,JF
"_Clor._ Now let me know what my best Art hath done,",JF
Helpt by the great power of the vertuous moon,JF
"In her full light; O you sons of Earth,",JF
"You only brood, unto whose happy birth",JF
"Vertue was given, holding more of nature",JF
"Than man her first born and most perfect creature,",JF
Let me adore you; you that only can,JF
"Help or kill nature, drawing out that span",JF
Of life and breath even to the end of time;,JF
"You that these hands did crop, long before prime",JF
"Of day; give me your names, and next your hidden power.",JF
"This is the _Clote_ bearing a yellow flower,",JF
"And this black Horehound, both are very good",JF
"For sheep or Shepherd, bitten by a wood-",JF
"Dogs venom'd tooth; these Ramuns branches are,",JF
"Which stuck in entries, or about the bar",JF
"That holds the door fast, kill all inchantments, charms,",JF
Were they _Medeas_ verses that doe harms,JF
To men or cattel; these for frenzy be,JF
"A speedy and a soveraign remedie,",JF
"The bitter Wormwood, Sage, and Marigold,",JF
Such sympathy with mans good they do hold;,JF
"This Tormentil, whose vertue is to part",JF
All deadly killing poyson from the heart;,JF
And here _Narcissus_ roots for swellings be:,JF
"Yellow _Lysimacus_, to give sweet rest",JF
"To the faint Shepherd, killing where it comes",JF
"All busie gnats, and every fly that hums:",JF
"For leprosie, Darnel, and Sellondine,",JF
"With Calamint, whose vertues do refine",JF
"The blood of man, making it free and fair",JF
"As the first hour it breath'd, or the best air.",JF
"Here other two, but your rebellious use",JF
"Is not for me, whose goodness is abuse;",JF
"Therefore foul Standergrass, from me and mine",JF
"I banish thee, with lustful Turpentine,",JF
You that intice the veins and stir the heat,JF
"To civil mutiny, scaling the seat",JF
"Our reason moves in, and deluding it",JF
"With dreams and wanton fancies, till the fit",JF
"Of burning lust be quencht; by appetite,",JF
Robbing the soul of blessedness and light:,JF
"And thou light _Varvin_ too, thou must go after,",JF
Provoking easie souls to mirth and laughter;,JF
"No more shall I dip thee in water now,",JF
"And sprinkle every post, and every bough",JF
"With thy well pleasing juyce, to make the grooms",JF
"Swell with high mirth, as with joy all the rooms.",JF
_Enter_ Thenot.,JF
_The_. This is the Cabin where the best of all,JF
"Her Sex, that ever breath'd, or ever shall",JF
"Give heat or happiness to the Shepherds side,",JF
Doth only to her worthy self abide.,JF
"Thou blessed star, I thank thee for thy light,",JF
Thou by whose power the darkness of sad night,JF
"Is banisht from the Earth, in whose dull place",JF
Thy chaster beams play on the heavy face,JF
"Of all the world, making the blue Sea smile,",JF
To see how cunningly thou dost beguile,JF
"Thy Brother of his brightness, giving day",JF
"Again from _Chaos_, whiter than that way",JF
"That leads to _Joves_ high Court, and chaster far",JF
"Than chastity it self, yon blessed star",JF
"That nightly shines: Thou, all the constancie",JF
"That in all women was, or e're shall be,",JF
"From whose fair eye-balls flyes that holy fire,",JF
"That Poets stile the Mother of desire,",JF
Infusing into every gentle brest,JF
"A soul of greater price, and far more blest",JF
"Than that quick power, which gives a difference,",JF
Twixt man and creatures of a lower sense.,JF
"_Clor_. Shepherd, how cam'st thou hither to this place?",JF
"No way is troden, all the verdant grass",JF
"The spring shot up, stands yet unbruised here",JF
"Of any foot, only the dapled Deer",JF
Far from the feared sound of crooked horn,JF
Dwels in this fastness.,JF
"_Th_. Chaster than the morn,",JF
"I have not wandred, or by strong illusion",JF
Into this vertuous place have made intrusion:,JF
But hither am I come (believe me fair),JF
"To seek you out, of whose great good the air",JF
"Is full, and strongly labours, whilst the sound",JF
"Breaks against Heaven, and drives into a stound",JF
"The amazed Shepherd, that such vertue can",JF
Be resident in lesser than a man.,JF
"_Clor_. If any art I have, or hidden skill",JF
"May cure thee of disease or festred ill,",JF
Whose grief or greenness to anothers eye,JF
"May seem impossible of remedy,",JF
I dare yet undertake it.,JF
_The_. 'Tis no pain,JF
"I suffer through disease, no beating vein",JF
"Conveyes infection dangerous to the heart,",JF
"No part impostum'd to be cur'd by Art,",JF
This body holds; and yet a feller grief,JF
Than ever skilfull hand did give relief,JF
"Dwells on my soul, and may be heal'd by you,",JF
Fair beauteous Virgin.,JF
"_Clor_. Then Shepherd, let me sue",JF
To know thy grief; that man yet never knew,JF
"The way to health, that durst not shew his sore.",JF
"_Then_. Then fairest, know, I love you.",JF
"_C[l]or_. Swain, no more,",JF
"Thou hast abus'd the strictness of this place,",JF
And offred Sacrilegious foul disgrace,JF
"To the sweet rest of these interred bones,",JF
"For fear of whose ascending, fly at once,",JF
"Thou and thy idle passions, that the sight",JF
Of death and speedy vengeance may not fright,JF
Thy very soul with horror.,JF
_Then_. Let me not,JF
(Thou all perfection) merit such a blot,JF
For my true zealous faith.,JF
_Clor_. Dar'st thou abide,JF
To see this holy Earth at once divide,JF
"And give her body up? for sure it will,",JF
If thou pursu'st with wanton flames to fill,JF
"This hallowed place; therefore repent and goe,",JF
"Whilst I with praise appease his Ghost below,",JF
That else would tell thee what it were to be,JF
A rival in that vertuous love that he,JF
Imbraces yet.,JF
_Then_. 'Tis not the white or red,JF
Inhabits in your cheek that thus can wed,JF
"My mind to adoration; nor your eye,",JF
"Though it be full and fair, your forehead high,",JF
And smooth as _Pelops_ shoulder; not the smile,JF
Lies watching in those dimples to beguile,JF
"The easie soul, your hands and fingers long",JF
"With veins inamel'd richly, nor your tongue,",JF
"Though it spoke sweeter than _Arions_ Harp,",JF
"Your hair wove into many a curious warp,",JF
Able in endless errour to infold,JF
"The wandring soul, nor the true perfect mould",JF
"Of all your body, which as pure doth show",JF
In Maiden whiteness as the Alpsian snow.,JF
"All these, were but your constancie away,",JF
Would please me less than a black stormy day,JF
The wretched Seaman toyling through the deep.,JF
"But whilst this honour'd strictness you dare keep,",JF
Though all the plagues that e're begotten were,JF
"In the great womb of air, were setled here,",JF
"In opposition, I would, like the tree,",JF
"Shake off those drops of weakness, and be free",JF
Even in the arm of danger.,JF
_Clor_. Wouldst thou have,JF
"Me raise again (fond man) from silent grave,",JF
"Those sparks that long agoe were buried here,",JF
With my dead friends cold ashes?,JF
"_Then_. Dearest dear,",JF
"I dare not ask it, nor you must not grant;",JF
"Stand strongly to your vow, and do not faint:",JF
"Remember how he lov'd ye, and be still",JF
"The same Opinion speaks ye; let not will,",JF
"And that great god of women, appetite,",JF
Set up your blood again; do not invite,JF
"Desire and fancie from their long exile,",JF
To set them once more in a pleasing smile:,JF
Be like a rock made firmly up 'gainst all,JF
"The power of angry Heaven, or the strong fall",JF
"Of _Neptunes_ battery; if ye yield, I die",JF
To all affection; 'tis that loyaltie,JF
Ye tie unto this grave I so admire;,JF
"And yet there's something else I would desire,",JF
"If you would hear me, but withall deny.",JF
"O _Pan_, what an uncertain destiny",JF
"Hangs over all my hopes! I will retire,",JF
"For if I longer stay, this double fire",JF
Will lick my life up.,JF
"_Clor_. Doe, let time wear out",JF
What Art and Nature cannot bring about.,JF
"_Then_. Farewel thou soul of vertue, and be blest",JF
"For ever, whilst that here I wretched rest",JF
Thus to my self; yet grant me leave to dwell,JF
In kenning of this Arbor; yon same dell,JF
O'retopt with morning Cypress and sad Yew,JF
"Shall be my Cabin, where I'le early rew,",JF
"Before the Sun hath kist this dew away,",JF
The hard uncertain chance which Fate doth lay,JF
Upon this head.,JF
_Clor_. The gods give quick release,JF
And happy cure unto thy hard disease.                [_Exeunt_.,JF
_Enter_ Sullen Shepherd.,JF
"_Sullen_. I do not love this wench that I should meet,",JF
For ne'r did my unconstant eye yet greet,JF
"That beauty, were it sweeter or more fair,",JF
"Than the new blossoms, when the morning air",JF
"Blows gently on the[m], or the breaking light,",JF
When many maiden blushes to our sight,JF
Shoot from his early face: were all these set,JF
"In some neat form before me, 'twould not get",JF
"The least love from me; some desire it might,",JF
Or present burning: all to me in sight,JF
"Are equal, be they fair, or black, or brown,",JF
"Virgin, or careless wanton, I can crown",JF
My appetite with any; swear as oft,JF
"And weep, as any, melt my words as soft",JF
"Into a maiden[s] ears, and tell how long",JF
"My heart has been her servant, and how strong",JF
"My passions are: call her unkind and cruel,",JF
Offer her all I have to gain the Jewel,JF
"Maidens so highly prize: then loath, and fly:",JF
This do I hold a blessed destiny.,JF
_Enter_ Amaryllis.,JF
"_Amar_. Hail Shepherd, _Pan_ bless both thy flock and thee,",JF
For being mindful of thy word to me.,JF
"_Sul_. Welcom fair Shepherdess, thy loving swain",JF
"Gives thee the self same wishes back again,",JF
"Who till this present hour ne're knew that eye,",JF
"Could make me cross mine arms, or daily dye",JF
"With fresh consumings: boldly tell me then,",JF
"How shall we part their faithful loves, and when?",JF
"Shall I bely him to her, shall I swear",JF
"His faith is false, and he loves every where?",JF
"I'le say he mockt her th' other day to you,",JF
"Which will by your confirming shew as true,",JF
"For he is of so pure an honesty,",JF
To think (because he will not) none will lye:,JF
"Or else to him I'le slander _Amoret_,",JF
"And say, she but seems chaste; I'le swear she met",JF
Me 'mongst the shady Sycamores last night,JF
And loosely offred up her flame and spright,JF
"Into my bosom, made a wanton bed",JF
"Of leaves and many flowers, where she spread",JF
Her willing body to be prest by me;,JF
"There have I carv'd her name on many a tree,",JF
Together with mine own; to make this show,JF
"More full of seeming, _Hobinall_ you know,",JF
"Son to the aged Shepherd of the glen,",JF
"Him I have sorted out of many men,",JF
"To say he found us at our private sport,",JF
And rouz'd us 'fore our time by his resort:,JF
"This to confirm, I have promis'd to the boy",JF
"Many a pretty knack, and many a toy,",JF
"As gins to catch him birds, with bow and bolt,",JF
To shoot at nimble Squirrels in the holt;,JF
"A pair of painted Buskins, and a Lamb,",JF
"Soft as his own locks, or the down of swan;",JF
"This I have done to win ye, which doth give",JF
Me double pleasure. Discord makes me live.,JF
"_Amar_. Lov'd swain, I thank ye, these tricks might prevail",JF
"With other rustick Shepherds, but will fail",JF
"Even once to stir, much more to overthrow",JF
"His fixed love from judgement, who doth know",JF
"Your nature, my end, and his chosens merit;",JF
"Therefore some stranger way must force his spirit,",JF
"Which I have found: give second, and my love",JF
Is everlasting thine.,JF
_Sul_. Try me and prove.,JF
"_Amar_. These happy pair of lovers meet straightway,",JF
"Soon as they fold their flocks up with the day,",JF
"In the thick grove bordering upon yon Hill,",JF
"In whose hard side Nature hath carv'd a well,",JF
"And but that matchless spring which Poets know,",JF
Was ne're the like to this: by it doth grow,JF
"About the sides, all herbs which Witches use,",JF
"All simples good for Medicine or abuse,",JF
"All sweets that crown the happy Nuptial day,",JF
"With all their colours, there the month of _May_",JF
"Is ever dwelling, all is young and green,",JF
There's not a grass on which was ever seen,JF
"The falling _Autumn_, or cold Winters hand,",JF
"So full of heat and vertue is the land,",JF
"About this fountain, which doth slowly break",JF
"Below yon Mountains foot, into a Creek",JF
"That waters all the vally, giving Fish",JF
"Of many sorts, to fill the Shepherds dish.",JF
"This holy well, my grandam that is dead,",JF
"Right wise in charms, hath often to me said,",JF
"Hath power to change the form of any creature,",JF
"Being thrice dipt o're the head, into what feature,",JF
"Or shape 'twould please the letter down to crave,",JF
"Who must pronounce this charm too, which she gave",JF
"Me on her death-bed; told me what, and how,",JF
"I should apply unto the Patients brow,",JF
"That would be chang'd, casting them thrice asleep,",JF
Before I trusted them into this deep.,JF
"All this she shew'd me, and did charge me prove",JF
"This secret of her Art, if crost in love.",JF
"I'le this attempt; now Shepherd, I have here",JF
"All her prescriptions, and I will not fear",JF
"To be my self dipt: come, my temples bind",JF
"With these sad herbs, and when I sleep you find,",JF
"As you do speak your charm, thrice down me let,",JF
And bid the water raise me _Amoret_;,JF
"Which being done, leave me to my affair,",JF
"And e're the day shall quite it self out-wear,",JF
"I will return unto my Shepherds arm,",JF
"Dip me again, and then repeat this charm,",JF
"And pluck me up my self, whom freely take,",JF
And the hotst fire of thine affection slake.,JF
"_Sul._  And if I fit thee not, then fit not me:",JF
I long the truth of this wells power to see.       [_Exeunt._,JF
_Enter Daphnis._,JF
"_Daph._  Here will I stay, for this the covert is",JF
"Where I appointed _Cloe_; do not miss,",JF
"Thou bright-ey'd virgin, come, O come my fair,",JF
"Be not abus'd with fear, nor let cold care",JF
"Of honour stay thee from the Shepherds arm,",JF
Who would as hard be won to offer harm,JF
"To thy chast thoughts, as whiteness from the day,",JF
Or yon great round to move another way.,JF
"My language shall be honest, full of truth,",JF
My flames as smooth and spotless as my youth:,JF
"I will not entertain that wandring thought,",JF
Whose easie current may at length be brought,JF
To a loose vastness.,JF
_Alexis within._  Cloe!,JF
"_Daph._  'Tis her voyce,",JF
"And I must answer, _Cloe_! Oh the choice",JF
"Of dear embraces, chast and holy strains",JF
Our hands shall give! I charge you all my veins,JF
"Through which the blood and spirit take their way,",JF
"Lock up your disobedient heats, and stay",JF
Those mutinous desires that else would grow,JF
To strong rebellion: do not wilder show,JF
Than blushing modesty may entertain.,JF
_Alexis within._  Cloe!,JF
"_Daph._  There sounds that [blessed] name again,",JF
_Enter_ Alexis.,JF
"And I will meet it: let me not mistake,",JF
This is some Shepherd! sure I am awake;,JF
"What may this riddle mean? I will retire,",JF
To give my self more knowledg.,JF
"_Alex._  Oh my fire,",JF
"How thou consum'st me! _Cloe,_ answer me,",JF
"_Alexis_, strong _Alexis_ , high and free,",JF
Calls upon _Cloe_. See mine arms are full,JF
"Of entertainment, ready for to pull",JF
That golden fruit which too too long hath hung,JF
"Tempting the greedy eye: thou stayest too long,",JF
I am impatient of these mad delayes;,JF
I must not leave unsought these many ways,JF
"That lead into this center, till I find",JF
"Quench for my burning lust. I come, unkind.       [_Exit_ Alexis.",JF
"_Daph._  Can my imagination work me so much ill,",JF
"That I may credit this for truth, and still",JF
Believe mine eyes? or shall I firmly hold,JF
"Her yet untainted, and these sights but bold",JF
Illusion? Sure such fancies oft have been,JF
"Sent to abuse true love, and yet are seen,",JF
Daring to blind the vertuous thought with errour.,JF
But be they far from me with their fond terrour:,JF
I am resolv'd my _Cloe_ yet is true.       [Cloe _within._,JF
"_Cloe_, hark, _Cloe_: Sure this voyce is new,",JF
"Whose shrilness like the sounding of a Bell,",JF
"Tells me it is a Woman: _Cloe_, tell",JF
Thy blessed name again. _Cloe_. [_within_] Here.,JF
"Oh what a grief is this to be so near,",JF
And not incounter!,JF
_Enter_ Cloe.,JF
"_Clo._  Shepherd, we are met,",JF
"Draw close into the covert, lest the wet",JF
Which falls like lazy mists upon the ground,JF
Soke through your Startups.,JF
_Daph._  Fairest are you found?,JF
"How have we wandred, that the better part",JF
Of this good night is perisht? Oh my heart!,JF
"How have I long'd to meet ye, how to kiss",JF
"Those lilly hands, how to receive the bliss",JF
That charming tongue gives to the happy ear,JF
Of him that drinks your language! but I fear,JF
"I am too much unmanner'd, far too rude,",JF
And almost grown lascivious to intrude,JF
"These hot behaviours; where regard of fame,",JF
"Honour, and modesty, a vertuous name,",JF
And such discourse as one fair Sister may,JF
"Without offence unto the Brother say,",JF
"Should rather have been tendred: but believe,",JF
Here dwells a better temper; do not grieve,JF
"Then, ever kindest, that my first salute",JF
"Seasons so much of fancy, I am mute",JF
"Henceforth to all discourses, but shall be",JF
Suiting to your sweet thoughts and modestie.,JF
"Indeed I will not ask a kiss of you,",JF
"No not to wring your fingers, nor to sue",JF
"To those blest pair of fixed stars for smiles,",JF
"All a young lovers cunning, all his wiles,",JF
"And pretty wanton dyings, shall to me",JF
Be strangers; only to your chastitie,JF
I am devoted ever.,JF
"_Clo_. Honest Swain,",JF
"First let me thank you, then return again",JF
"As much of my love: no thou art too cold,",JF
"Unhappy Boy, not tempred to my mold,",JF
"Thy blood falls heavy downward, 'tis not fear",JF
"To offend in boldness wins, they never wear",JF
Deserved favours that deny to take,JF
When they are offered freely: Do I wake,JF
"To see a man of his youth, years and feature,",JF
"And such a one as we call goodly creature,",JF
Thus backward? What a world of precious Art,JF
"Were meerly lost, to make him do his part?",JF
"But I will shake him off, that dares not hold,",JF
Let men that hope to be belov'd be bold.,JF
"_Daphnis_, I do desire, since we are met",JF
"So happily, our lives and fortunes set",JF
"Upon one stake, to give assurance now,",JF
"By interchange of hands and holy vow,",JF
Never to break again: walk you that way,JF
Whilest I in zealous meditation stray,JF
A little this way: when we both have ended,JF
"These rites and duties, by the woods befriended,",JF
"And secrecie of night, retire and find",JF
"An aged Oak, whose hollowness may bind",JF
"Us both within his body, thither go,",JF
It stands within yon bottom.,JF
_Daph_. Be it so.                          [_Ex_. Daph.,JF
"_Clo_. And I will meet there never more with thee,",JF
Thou idle shamefastness.,JF
_Alex. [within] Chloe!_,JF
_Clo_. 'Tis he,JF
That dare I hope be bolder.,JF
_Alex. Cloe!_,JF
_Clo_. Now,JF
Great _Pan_ for _Syrinx_ sake bid speed our Plow.     [_Exit_ Cloe.,JF
_Actus Tertius. Scena Prima.,JF
_Enter_ Sullen Shepherd _with_ Amaryllis _in a sleep._,JF
_Sull_. From thy forehead thus I take,JF
"These herbs, and charge thee not awake",JF
"Till in yonder holy Well,",JF
"Thrice with powerful Magick spell,",JF
"Fill'd with many a baleful word,",JF
Thou hast been dipt; thus with my cord,JF
"Of blasted Hemp, by Moon-light twin'd,",JF
I do thy sleepy body bind;,JF
"I turn thy head into the East,",JF
"And thy feet into the West,",JF
"Thy left arm to the South put forth,",JF
And thy right unto the North:,JF
"I take thy body from the ground,",JF
"In this deep and deadly swound,",JF
And into this holy spring,JF
I let thee slide down by my string.,JF
"Take this Maid thou holy pit,",JF
"To thy bottom, nearer yet,",JF
"In thy water pure and sweet,",JF
By thy leave I dip her feet;,JF
"Thus I let her lower yet,",JF
That her ankles may be wet;,JF
"Yet down lower, let her knee",JF
In thy waters washed be;,JF
There stop: Fly away,JF
Every thing that loves the day.,JF
"Truth that hath but one face,",JF
Thus I charm thee from this place.,JF
"Snakes that cast your coats for new,",JF
"Camelions that alter hue,",JF
"Hares that yearly Sexes change,",JF
"_Proteus_ alt'ring oft and strange,",JF
"_Hecate_ with shapes three,",JF
"Let this Maiden changed be,",JF
"With this holy water wet,",JF
To the shape of _Amoret_:,JF
"_Cynthia_ work thou with my charm,",JF
Thus I draw thee free from harm,JF
"Up out of this blessed Lake,",JF
Rise both like her and awake.                   [_She awakes_.,JF
"_Amar_. Speak Shepherd, am I _Amoret_ to sight?",JF
Or hast thou mist in any Magick rite;,JF
"For want of which any defect in me,",JF
May make our practices discovered be.,JF
"_Sul_. By yonder Moon, but that I here do stand,",JF
"Whose breath hath thus transform'd thee, and whose hand",JF
"Let thee down dry, and pluckt thee up thus wet,",JF
I should my self take thee for _Amoret_;,JF
"Thou art in cloths, in feature, voice and hew",JF
"So like, that sense cannot distinguish you.",JF
"_Amar_. Then this deceit which cannot crossed be,",JF
"At once shall lose her him, and gain thee me.",JF
"Hither she needs must come by promise made,",JF
"And sure his nature never was so bad,",JF
"To bid a Virgin meet him in the wood,",JF
"When night and fear are up, but understood,",JF
"Twas his part to come first: being come, I'le say,",JF
"My constant love made me come first and stay,",JF
"Then will I lead him further to the grove,",JF
"But stay you here, and if his own true love",JF
"Shall seek him here, set her in some wrong path,",JF
"Which say, her lover lately troden hath;",JF
"I'le not be far from hence, if need there be,",JF
"Here is another charm, whose power will free",JF
"The dazeled sense, read by the Moons beams clear,",JF
And in my own true map make me appear.,JF
_Enter_ Perigot.,JF
"_Sull_. Stand close, here's _Perigot_, whose constant heart",JF
Longs to behold her in whose shape thou art.,JF
_Per_. This is the place (fair _Amoret_) the hour,JF
Is yet scarce come: Here every Sylvan power,JF
"Delights to be about yon sacred Well,",JF
Which they have blest with many a powerful Spell;,JF
"For never Traveller in dead of Night,",JF
"Nor strayed Beasts have faln in, but when sight",JF
"Hath fail'd them, then their right way they have found",JF
"By help of them, so holy is the ground:",JF
"But I will farther seek, lest _Amoret_",JF
"Should be first come, and so stray long unmet.",JF
"My _Amoret, Amoret_.          [_Ex_. Amaryllis, Perigot.",JF
_Per_. My Love.,JF
_Amar_. I come my Love.                       [_Exit_.,JF
_Sull_. Now she has got,JF
"Her own desires, and I shall gainer be",JF
