line,au_code
Of my long lookt for hopes as well as she.,JF
"How bright the moon shines here, as if she strove",JF
"To show her Glory in this little Grove,",JF
_Enter_ Amoret.,JF
To some new loved Shepherd. Yonder is,JF
Another _Amoret_. Where differs this,JF
"From that? but that she _Perigot_ hath met,",JF
I should have ta'n this for the counterfeit:,JF
"Herbs, Woods, and Springs, the power that in you lies,",JF
If mortal men could know your Properties!,JF
"_Amo_. Methinks it is not Night, I have no fear,",JF
"Walking this Wood, of Lions, or the Bear,",JF
"Whose Names at other times have made me quake,",JF
When any Shepherdess in her tale spake,JF
"Of some of them, that underneath a Wood",JF
Have torn true Lovers that together stood.,JF
"Methinks there are no Goblins, and mens talk,",JF
"That in these Woods the nimble Fairies walk,",JF
"Are fables; such a strong heart I have got,",JF
Because I come to meet with _Perigot_.,JF
"My _Perigot_! who's that, my _Perigot_?",JF
_Sull_. Fair maid.,JF
"_Amo_. Ay me, thou art not _Perigot_.",JF
_Sull_. But I can tell ye news of _Perigot_:,JF
An hour together under yonder tree,JF
"He sate with wreathed arms and call'd on thee,",JF
"And said, why _Amoret_ stayest thou so long?",JF
"Then starting up, down yonder path he flung,",JF
"Lest thou hadst miss'd thy way: were it day light,",JF
He could not yet have born him out of sight.,JF
"_Amor_. Thanks, gentle Shepherd, and beshrew my stay,",JF
That made me fearful I had lost my way:,JF
As fast as my weak Legs (that cannot be,JF
"Weary with seeking him) will carry me,",JF
I'll seek him out; and for thy Courtesie,JF
Pray _Pan_ thy Love may ever follow thee.        [_Exit_.,JF
"_Sull_. How bright she was, how lovely did she show!",JF
Was it not pity to deceive her so?,JF
"She pluckt her Garments up, and tript away,",JF
And with her Virgin-innocence did pray,JF
"For me that perjur'd her. Whilst she was here,",JF
Methought the Beams of Light that did appear,JF
"Were shot from her; methought the Moon gave none,",JF
But what it had from her: she was alone,JF
"With me, if then her presence did so move,",JF
Why did not I essay to win her Love?,JF
She would not sure have yielded unto me;,JF
"Women love only Opportunitie,",JF
"And not the Man; or if she had deny'd,",JF
"Alone, I might have forc'd her to have try'd",JF
"Who had been stronger: O vain Fool, to let",JF
"Such blest Occasion pass; I'll follow yet,",JF
"My Blood is up, I cannot now forbear.",JF
"_Enter_ Alex, _and_ Cloe.",JF
I come sweet _Amoret_: Soft who is here?,JF
A pair of Lovers? He shall yield her me;,JF
"""Now Lust is up, alike all Women be.",JF
"_Alex_. Where shall we rest? but for the love of me,",JF
"_Cloe_, I know ere this would weary be.",JF
"_Clo_. _Alexis_, let us rest here, if the place",JF
"Be private, and out of the common trace",JF
Of every Shepherd: for I understood,JF
This Night a number are about the Wood:,JF
"Then let us chuse some place, where out of sight",JF
We freely may enjoy our stoln delight.,JF
"_Alex_. Then boldly here, where we shall ne're be found,",JF
"No Shepherds way lies here, 'tis hallow'd ground:",JF
"No Maid seeks here her strayed Cow, or Sheep,",JF
"Fairies, and Fawns, and Satyrs do it keep:",JF
"Then carelesly rest here, and clip and kiss,",JF
And let no fear make us our pleasures miss.,JF
"_Clo_. Then lye by me, the sooner we begin,",JF
The longer ere the day descry our sin.,JF
"_Sull_. Forbear to touch my Love, or by yon flame,",JF
"The greatest power that Shepherds dare to name,",JF
Here where thou sit'st under this holy tree,JF
"Her to dishonour, thou shalt buried be.",JF
"_Alex_. If _Pan_ himself, should come out of the lawns,",JF
"With all his Troops of Satyrs and of Fawns,",JF
"And bid me leave, I swear by her two eyes,",JF
"A greater Oath than thine, I would not rise.",JF
"_Sull_. Then from the cold Earth never shalt thou move,",JF
But lose at one stroke both thy Life and Love.,JF
_Clo_. Hold gentle Shepherd.,JF
"_Sull_. Fairest Shepherdess,",JF
"Come you with me, I do not love you less",JF
"Than that fond man, that would have kept you there",JF
From me of more desert.,JF
_Alex_. O yet forbear,JF
To take her from me; give me leave to dye,JF
By her.,JF
"[_The Satyr enters, he runs one way, and she another_.",JF
"_Sat_. Now whilst the Moon doth rule the Skie,",JF
"And the Stars, whose feeble light",JF
"Give a pale Shadow to the night,",JF
"Are up, great _Pan_ commanded me",JF
"To walk this Grove about, whilst he",JF
"In a corner of the Wood,",JF
"Where never mortal foot hath stood,",JF
"Keeps dancing, musick, and a feast",JF
"To entertain a lovely Guest,",JF
"Where he gives her many a Rose,",JF
Sweeter than the breath that blows,JF
"The leaves; Grapes, Berries of the best,",JF
I never saw so great a feast.,JF
"But to my Charge: here must I stay,",JF
"To see what mortals lose their way,",JF
"And by a false fire seeming bright,",JF
Train them in and leave them right.,JF
Then must I watch if any be,JF
Forcing of a Chastitie:,JF
"If I find it, then in haste",JF
"Give my wreathed horn a Blast,",JF
"And the Fairies all will run,",JF
"Wildly dancing by the Moon,",JF
"And will pinch him to the bone,",JF
Till his lustful thoughts be gone.,JF
_Alex_. O Death!,JF
"_Sat_. Back again about this ground,",JF
Sure I hear a mortal sound;,JF
"I bind thee by this powerful Spell,",JF
"By the Waters of this Well,",JF
"By the glimmering Moon beams bright,",JF
"Speak again, thou mortal wight.",JF
_Alex_. Oh!,JF
"_Sat_. Here the foolish mortal lies,",JF
Sleeping on the ground: arise.,JF
"The poor wight is almost dead,",JF
"On the ground his wounds have bled,",JF
And his cloaths foul'd with his blood:,JF
To my Goddess in the Wood,JF
"Will I lead him, whose hands pure,",JF
Will help this mortal wight to cure.,JF
_Enter_ Cloe _again_.,JF
"_Clo_. Since I beheld yon shaggy man, my Breast",JF
"Doth pant, each bush, methinks, should hide a Beast:",JF
"Yet my desire keeps still above my fear,",JF
"I would fain meet some Shepherd, knew I where:",JF
"For from one cause of fear I am most free,",JF
"It is impossible to ravish me,",JF
I am so willing.  Here upon this ground,JF
I left my Love all bloody with his wound;,JF
"Yet till that fearful shape made me be gone,",JF
"Though he were hurt, I furnisht was of one,",JF
"But now both lost. _Alexis_, speak or move,",JF
"If thou hast any life, thou art yet my Love.",JF
"He's dead, or else is with his little might",JF
Crept from the Bank for fear of that ill Spright.,JF
"Then where art thou that struck'st my love? O stay,",JF
"Bring me thy self in change, and then I'll say",JF
"Thou hast some justice, I will make thee trim",JF
With Flowers and Garlands that were meant for him;,JF
"I'll clip thee round with both mine arms, as fast",JF
As I did mean he should have been embrac'd:,JF
But thou art fled. What hope is left for me?,JF
"I'll run to _Daphnis_ in the hollow tree,",JF
"Whom I did mean to mock, though hope be small,",JF
"To make him bold; rather than none at all,",JF
"I'll try him; his heart, and my behaviour too",JF
Perhaps may teach him what he ought to do.           [_Exit_.,JF
_Enter_ Sullen Shepherd.,JF
"_Sul_. This was the place, 'twas but my feeble sight,",JF
"Mixt with the horrour of my deed, and night,",JF
"That shap't these fears, and made me run away,",JF
And lose my beauteous hardly gotten prey.,JF
"Speak gentle Shepherdess, I am alone,",JF
And tender love for love: but she is gone,JF
"From me, that having struck her Lover dead,",JF
For silly fear left her alone and fled.,JF
And see the wounded body is remov'd,JF
By her of whom it was so well belov'd.,JF
_Enter_ Perigot _and_ Amaryllis _in the shape of_ Amoret.,JF
"But these fancies must be quite forgot,",JF
I must lye close. Here comes young _Perigot_,JF
With subtile _Amaryllis_ in the shape,JF
Of _Amoret_. Pray Love he may not 'scape.,JF
"_Amar_. Beloved _Perigot_, shew me some place,",JF
"Where I may rest my limbs, weak with the Chace",JF
"Of thee, an hour before thou cam'st at least.",JF
_Per_. Beshrew my tardy steps: here shalt thou rest,JF
"Upon this holy bank, no deadly Snake",JF
Upon this turf her self in folds doth make.,JF
Here is no poyson for the Toad to feed;,JF
"Here boldly spread thy hands, no venom'd Weed",JF
"Dares blister them, no slimy Snail dare creep",JF
Over thy face when thou art fast asleep;,JF
"Here never durst the babling Cuckow spit,",JF
No slough of falling Star did ever hit,JF
"Upon this bank: let this thy Cabin be,",JF
This other set with Violets for me.,JF
_Ama_. Thou dost not love me _Perigot_.,JF
"_Per_. Fair maid,",JF
You only love to hear it often said;,JF
You do not doubt.,JF
_Amar_. Believe me but I do.,JF
_Per_. What shall we now begin again to woo?,JF
"Tis the best way to make your Lover last,",JF
"To play with him, when you have caught him fast.",JF
"_Amar_. By _Pan_ I swear, I loved _Perigot_,",JF
"And by yon Moon, I think thou lov'st me not.",JF
"_Per_. By _Pan_ I swear, and if I falsely swear,",JF
"Let him not guard my flocks, let Foxes tear",JF
"My earliest Lambs, and Wolves whilst I do sleep",JF
"Fall on the rest, a Rot among my Sheep.",JF
I love thee better than the careful Ewe,JF
The new-yean'd Lamb that is of her own hew;,JF
I dote upon thee more than the young Lamb,JF
Doth on the bag that feeds him from his Dam.,JF
"Were there a sort of Wolves got in my Fold,",JF
"And one ran after thee, both young and old",JF
"Should be devour'd, and it should be my strife",JF
"To save thee, whom I love above my life.",JF
_Ama_. How shall I trust thee when I see thee chuse,JF
"Another Bed, and dost my side refuse?",JF
_Per_. 'Twas only that the chast thoughts might be shewn,JF
"Twixt thee and me, although we were alone.",JF
"_Ama_. Come, _Perigot_ will shew his power, that he",JF
"Can make his _Amoret_, though she weary be,",JF
"Rise nimbly from her Couch, and come to his.",JF
"Here take thy _Amoret_, embrace and kiss.",JF
_Per_. What means my Love?,JF
"_Ama_. To do as lovers shou'd,",JF
"That are to be enjoy'd, not to be woo'd.",JF
There's ne'r a Shepherdess in all the plain,JF
"Can kiss thee with more Art, there's none can feign",JF
More wanton tricks.,JF
"_Per_. Forbear, dear Soul, to trie",JF
Whether my Heart be pure; I'll rather die,JF
Than nourish one thought to dishonour thee.,JF
_Amar_. Still think'st thou such a thing as Chastitie,JF
"Is amongst Women? _Perigot_ there's none,",JF
"That with her Love is in a Wood alone,",JF
And would come home a maid; be not abus'd,JF
"With thy fond first Belief, let time be us'd:",JF
Why dost thou rise?,JF
_Per_. My true heart thou hast slain.,JF
"_Ama_. Faith _Perigot_, I'll pluck thee down again.",JF
"_Per_. Let go, thou Serpent, that into my brest",JF
Hast with thy cunning div'd; art not in Jest?,JF
"_Ama_. Sweet love, lye down.",JF
"_Per_. Since this I live to see,",JF
Some bitter North-wind blast my flocks and me.,JF
"_Ama_. You swore you lov'd, yet will not do my will.",JF
"_Per_. O be as thou wert once, I'll love thee still.",JF
"_Ama_. I am, as still I was, and all my kind,",JF
Though other shows we have poor men to blind.,JF
"_Per_. Then here I end all Love, and lest my vain",JF
"Belief should ever draw me in again,",JF
"Before thy face that hast my Youth misled,",JF
"I end my life, my blood be on thy head.",JF
"_Ama._ O hold thy hands, thy _Amoret_ doth cry.",JF
"_Per._ Thou counsel'st well, first _Amoret_ shall dye,",JF
That is the cause of my eternal smart.   [_He runs after her._,JF
_Ama._ O hold.,JF
_Per._ This steel shall pierce thy lustful heart.,JF
[_The Sullen Shepherd steps out and uncharms her._,JF
"_Sull._ Up and down every where,",JF
I strew the herbs to purge the air:,JF
Let your Odour drive hence,JF
All mists that dazel sence.,JF
Herbs and Springs whose hidden might,JF
"Alters Shapes, and mocks the sight,",JF
Thus I charge you to undo,JF
All before I brought ye to:,JF
"Let her flye, let her 'scape,",JF
Give again her own shape.,JF
_Enter_ Amaryllis _in her own shape._,JF
"_Amar._ Forbear thou gentle Swain, thou dost mistake,",JF
"She whom thou follow'dst fled into the brake,",JF
"And as I crost thy way, I met thy wrath,",JF
The only fear of which near slain me hath.,JF
"_Per._ Pardon fair Shepherdess, my rage and night",JF
"Were both upon me, and beguil'd my sight;",JF
But far be it from me to spill the blood,JF
Of harmless Maids that wander in the Wood.         [_Ex._ Ama.,JF
_Enter_ Amoret.,JF
_Amor._ Many a weary step in yonder path,JF
Poor hopeless _Amoret_ twice trodden hath,JF
"To seek her _Perigot_, yet cannot hear",JF
"His Voice; my _Perigot_, she loves thee dear",JF
That calls.,JF
"_Per._ See yonder where she is, how fair",JF
"She shows, and yet her breath infefts the air.",JF
_Amo._ My Perigot.,JF
_Per._ Here.,JF
_Amo._ Happy.,JF
_Per._ Hapless first:,JF
"It lights on thee, the next blow is the worst.",JF
"_Amo._ Stay _Perigot_, my love, thou art unjust.",JF
_Peri._ Death is the best reward that's due to lust.     [_Exit_ Perigot.,JF
"_Sul._ Now shall their love be crost, for being struck,",JF
"I'le throw her in the Fount, lest being took",JF
"By some night-travaller, whose honest care",JF
May help to cure her. Shepherdess prepare,JF
Your self to die.,JF
"_Amo._ No Mercy I do crave,",JF
Thou canst not give a worse blow than I have;,JF
"Tell him that gave me this, who lov'd him too,",JF
"He struck my soul, and not my body through,",JF
"Tell him when I am dead, my soul shall be",JF
"At peace, if he but think he injur'd me.",JF
"_Sul._ In this Fount be thy grave, thou wert not meant",JF
"Sure for a woman, thou art so innocent.       [_flings her into the well_",JF
"She cannot scape, for underneath the ground,",JF
"In a long hollow the clear spring is bound,",JF
"Till on yon side where the Morns Sun doth look,",JF
The strugling water breaks out in a Brook.      [_Exit._,JF
[_The God of the River riseth with_ Amoret _in his arms._,JF
_God._ What powerfull charms my streams do bring,JF
"Back again unto their spring,",JF
"With such force, that I their god,",JF
"Three times striking with my Rod,",JF
Could not keep them in their ranks:,JF
"My Fishes shoot into the banks,",JF
"There's not one that stayes and feeds,",JF
All have hid them in the weeds.,JF
"Here's a mortal almost dead,",JF
"Faln into my River head,",JF
"Hallowed so with many a spell,",JF
That till now none ever fell.,JF
"Tis a Female young and clear,",JF
Cast in by some Ravisher.,JF
"See upon her breast a wound,",JF
On which there is no plaister bound.,JF
"Yet she's warm, her pulses beat,",JF
Tis a sign of life and heat.,JF
"If thou be'st a Virgin pure,",JF
I can give a present cure:,JF
Take a drop into thy wound,JF
From my watry locks more round,JF
"Than Orient Pearl, and far more pure",JF
Than unchast flesh may endure.,JF
"See she pants, and from her flesh",JF
The warm blood gusheth out afresh.,JF
She is an unpolluted maid;,JF
I must have this bleeding staid.,JF
From my banks I pluck this flower,JF
"With holy hand, whose vertuous power",JF
Is at once to heal and draw.,JF
The blood returns. I never saw,JF
A fairer Mortal. Now doth break,JF
"Her deadly slumber: Virgin, speak.",JF
"_Amo._ Who hath restor'd my sense, given me new breath,",JF
And brought me back out of the arms of death?,JF
_God._ I have heal'd thy wounds.,JF
_Amo._ Ay me!,JF
_God._ Fear not him that succour'd thee:,JF
"I am this Fountains god; below,",JF
"My waters to a River grow,",JF
"And 'twixt two banks with Osiers set,",JF
"That only prosper in the wet,",JF
"Through the Meadows do they glide,",JF
"Wheeling still on every side,",JF
"Sometimes winding round about,",JF
To find the evenest channel out.,JF
"And if thou wilt go with me,",JF
"Leaving mortal companie,",JF
"In the cool streams shalt thou lye,",JF
Free from harm as well as I:,JF
"I will give thee for thy food,",JF
"No Fish that useth in the mud,",JF
But Trout and Pike that love to swim,JF
Where the gravel from the brim,JF
Through the pure streams may be seen:,JF
"Orient Pearl fit for a Queen,",JF
"Will I give thy love to win,",JF
And a shell to keep them in:,JF
Not a Fish in all my Brook,JF
"That shall disobey thy look,",JF
"But when thou wilt, come sliding by,",JF
And from thy white hand take a fly.,JF
"And to make thee understand,",JF
"How I can my waves command,",JF
They shall bubble whilst I sing,JF
Sweeter than the silver spring.,JF
_The SONG.,JF
Do not fear to put thy feet,JF
Naked in the River sweet;,JF
"Think not Leach, or Newt or Toad",JF
"Will bite thy foot, when thou hast troad;",JF
"Nor let the water rising high,",JF
"As thou wad'st in, make thee crie",JF
"And sob, but ever live with me,",JF
And not a wave shall trouble thee._,JF
"_Amo._ Immortal power, that rul'st this holy flood,",JF
I know my self unworthy to be woo'd,JF
"By thee a god: for e're this, but for thee",JF
I should have shown my weak Mortalitie:,JF
"Besides, by holy Oath betwixt us twain,",JF
"I am betroath'd unto a Shepherd swain,",JF
"Whose comely face, I know the gods above",JF
"May make me leave to see, but not to love.",JF
_God._ May he prove to thee as true.,JF
"Fairest Virgin, now adieu,",JF
"I must make my waters fly,",JF
"Lest they leave their Channels dry,",JF
And beasts that come unto the spring,JF
"Miss their mornings watering,",JF
Which I would not; for of late,JF
All the neighbour people sate,JF
"On my banks, and from the fold,",JF
Two white Lambs of three weeks old,JF
Offered to my Deitie:,JF
For which this year they shall be free,JF
"From raging floods, that as they pass",JF
Leave their gravel in the grass:,JF
"Nor shall their Meads be overflown,",JF
When their grass is newly mown.,JF
"_Amo._ For thy kindness to me shown,",JF
Never from thy banks be blown,JF
"Any tree, with windy force,",JF
"Cross thy streams, to stop thy course:",JF
"May no beast that comes to drink,",JF
With his horns cast down thy brink;,JF
"May none that for thy fish do look,",JF
Cut thy banks to damm thy Brook;,JF
Bare-foot may no Neighbour wade,JF
"In thy cool streams, wife nor maid,",JF
"When the spawns on stones do lye,",JF
"To wash their Hemp, and spoil the Fry.",JF
"_God._ Thanks Virgin, I must down again,",JF
Thy wound will put thee to no pain:,JF
Wonder not so soon 'tis gone:,JF
A holy hand was laid upon.,JF
"_Amo._ And I unhappy born to be,",JF
Must follow him that flies from me.,JF
_Actus Quartus. Scena Prima._,JF
_Enter_ Perigot.,JF
"_Per._ She is untrue, unconstant, and unkind,",JF
"She's gone, she's gone, blow high thou North-west wind,",JF
"And raise the Sea to Mountains, let the Trees",JF
"That dare oppose thy raging fury, leese",JF
"Their firm foundation, creep into the Earth,",JF
"And shake the world, as at the monstrous birth",JF
"Of some new Prodigy, whilst I constant stand,",JF
"Holding this trustie Boar-spear in my hand,",JF
And falling thus upon it.,JF
"_Enter_ Amaryllis, _running._",JF
"_Amar._ Stay thy dead-doing hand, thou art too hot",JF
"Against thy self, believe me comely Swain,",JF
"If that thou dyest, not all the showers of Rain",JF
The heavy clods send down can wash away,JF
"That foul unmanly guilt, the world will lay",JF
Upon thee. Yet thy love untainted stands:,JF
"Believe me, she is constant, not the sands",JF
Can be so hardly numbred as she won:,JF
"I do not trifle, _Shepherd_, by the Moon,",JF
"And all those lesser lights our eyes do view,",JF
"All that I told thee _Perigot_, is true:",JF
"Then be a free man, put away despair,",JF
"And will to dye, smooth gently up that fair",JF
Dejected forehead: be as when those eyes,JF
Took the first heat.,JF
"_Per._ Alas he double dyes,",JF
"That would believe, but cannot; 'tis not well",JF
"Ye keep me thus from dying, here to dwell",JF
"With many worse companions: but oh death,",JF
I am not yet inamour'd of this breath,JF
"So much, but I dare leave it, 'tis not pain",JF
"In forcing of a wound, nor after gain",JF
"Of many dayes, can hold me from my will:",JF
"Tis not my self, but _Amoret_, bids kill.",JF
"_Ama._ Stay but a little, little, but one hour,",JF
And if I do not show thee through the power,JF
"Of herbs and words I have, as dark as night,",JF
"My self turn'd to thy _Amoret_, in sight,",JF
"Her very figure, and the Robe she wears,",JF
"With tawny Buskins, and the hook she bears",JF
"Of thine own Carving, where your names are set,",JF
"Wrought underneath with many a curious fret,",JF
"The _Prim-Rose_ Chaplet, taudry-lace and Ring,",JF
"Thou gavest her for her singing, with each thing",JF
"Else that she wears about her, let me feel",JF
The first fell stroke of that Revenging steel.,JF
"_Per._ I am contented, if there be a hope",JF
"To give it entertainment, for the scope",JF
"Of one poor hour; goe, you shall find me next",JF
"Under yon shady Beech, even thus perplext,",JF
And thus believing.,JF
"_Ama._ Bind before I goe,",JF
"Thy soul by _Pan_ unto me, not to doe",JF
"Harm or outragious wrong upon thy life,",JF
Till my return.,JF
"_Per._ By _Pan_, and by the strife",JF
"He had with _Phoebus_ for the Mastery,",JF
"When Golden _Midas_ judg'd their _Minstrelcy_,",JF
I will not.                                      [_Exeunt._,JF
"_Enter_ Satyr, _with_ Alexis, _hurt._",JF
"_Satyr._ Softly gliding as I goe,",JF
"With this burthen full of woe,",JF
"Through still silence of the night,",JF
"Guided by the Gloe-worms light,",JF
"Hither am I come at last,",JF
Many a Thicket have I past,JF
"Not a twig that durst deny me,",JF
"Not a bush that durst descry me,",JF
To the little Bird that sleeps,JF
On the tender spray: nor creeps,JF
"That hardy worm with pointed tail,",JF
"But if I be under sail,",JF
"Flying faster than the wind,",JF
"Leaving all the clouds behind,",JF
But doth hide her tender head,JF
In some hollow tree or bed,JF
Of seeded Nettles: not a Hare,JF
"Can be started from his fare,",JF
"By my footing, nor a wish",JF
"Is more sudden, nor a fish",JF
"Can be found with greater ease,",JF
"Cut the vast unbounded seas,",JF
"Leaving neither print nor sound,",JF
"Than I, when nimbly on the ground,",JF
I measure many a league an hour:,JF
"But behold the happy power,",JF
"That must ease me of my charge,",JF
And by holy hand enlarge,JF
"The soul of this sad man, that yet",JF
Lyes fast bound in deadly fit;,JF
Heaven and great _Pan_ succour it!,JF
"Hail thou beauty of the bower,",JF
Whiter than the Paramour,JF
"Of my Master, let me crave",JF
Thy vertuous help to keep from Grave,JF
"This poor Mortal that here lyes,",JF
Waiting when the destinies,JF
Will cut off his thred of life:,JF
View the wound by cruel knife,JF
Trencht into him.,JF
"_Clor._ What art thou call'st me from my holy rites,",JF
And with thy feared name of death affrights,JF
My tender Ears? speak me thy name and will.,JF
_Satyr._ I am the _Satyr_ that did fill,JF
"Your lap with early fruit, and will,",JF
"When I hap to gather more,",JF
Bring ye better and more store:,JF
"Yet I come not empty now,",JF
"See a blossom from the bow,",JF
"But beshrew his heart that pull'd it,",JF
And his perfect sight that cull'd it,JF
From the other springing blooms;,JF
For a sweeter youth the Grooms,JF
"Cannot show me, nor the downs,",JF
Nor the many neighbouring towns;,JF
"Low in yonder glade I found him,",JF
"Softly in mine Arms I bound him,",JF
Hither have I brought him sleeping,JF
"In a trance, his wounds fresh weeping,",JF
In remembrance such youth may,JF
Spring and perish in a day.,JF
"_Clor._ _Satyr_, they wrong thee, that do term thee rude,",JF
"Though thou beest outward rough and tawny hu'd,",JF
Thy manners are as gentle and as fair,JF
"As his, who brags himself, born only heir",JF
To all Humanity: let me see the wound:,JF
This Herb will stay the current being bound,JF
"Fast to the Orifice, and this restrain",JF
"Ulcers, and swellings, and such inward pain,",JF
As the cold air hath forc'd into the sore:,JF
This to draw out such putrifying gore,JF
As inward falls.,JF
_Satyr._ Heaven grant it may doe good.,JF
_Clor._ Fairly wipe away the blood:,JF
Hold him gently till I fling,JF
Water of a vertuous spring,JF
On his temples; turn him twice,JF
"To the Moon beams, pinch him thrice,",JF
That the labouring soul may draw,JF
From his great eclipse.,JF
_Satyr._ I saw,JF
His eye-lids moving.,JF
"_Clo._ Give him breath,",JF
All the danger of cold death,JF
"Now is vanisht; with this Plaster,",JF
"And this unction, do I master",JF
All the festred ill that may,JF
Give him grief another day.,JF
_Satyr._ See he gathers up his spright,JF
And begins to hunt for light;,JF
Now he gapes and breaths again:,JF
"How the blood runs to the vein,",JF
That erst was empty!,JF
"_Alex._ O my heart,",JF
"My dearest, dearest _Cloe_, O the smart",JF
Runs through my side: I feel some pointed thing,JF
"Pass through my Bowels, sharper than the sting",JF
Of Scorpion.,JF
"Pan preserve me, what are you?",JF
"Do not hurt me, I am true",JF
"To my _Cloe_, though she flye,",JF
And leave me to thy destiny.,JF
"There she stands, and will not lend",JF
Her smooth white hand to help her friend:,JF
"But I am much mistaken, for that face",JF
"Bears more Austerity and modest grace,",JF
More reproving and more awe,JF
Than these eyes yet ever saw,JF
In my Cloe. Oh my pain,JF
Eagerly renews again.,JF
Give me your help for his sake you love best.,JF
"_Clor._ Shepherd, thou canst not possibly take rest,",JF
Till thou hast laid aside all hearts desires,JF
"Provoking thought that stir up lusty fires,",JF
"Commerce with wanton eyes, strong blood, and will",JF
"To execute, these must be purg'd, untill",JF
