line,au_code
_Actus Primus. Scena Prima._,JF
"_Enter_ Clorin _a shepherdess, having buried her Love in an Arbour._",JF
"Hail, holy Earth, whose cold Arms do imbrace",JF
The truest man that ever fed his flocks,JF
"By the fat plains of fruitful _Thessaly_,",JF
"Thus I salute thy Grave, thus do I pay",JF
"My early vows, and tribute of mine eyes",JF
To thy still loved ashes; thus I free,JF
My self from all insuing heats and fires,JF
"Of love: all sports, delights and jolly games",JF
"That Shepherds hold full dear, thus put I off.",JF
Now no more shall these smooth brows be begirt,JF
"With youthful Coronals, and lead the Dance;",JF
No more the company of fresh fair Maids,JF
"And wanton Shepherds be to me delightful,",JF
Nor the shrill pleasing sound of merry pipes,JF
"Under some shady dell, when the cool wind",JF
"Plays on the leaves: all be far away,",JF
Since thou art far away; by whose dear side,JF
How often have I sat Crown'd with fresh flowers,JF
"For summers Queen, whil'st every Shepherds Boy",JF
"Puts on his lusty green, with gaudy hook,",JF
And hanging scrip of finest Cordevan.,JF
"But thou art gone, and these are gone with thee,",JF
And all are dead but thy dear memorie;,JF
"That shall out-live thee, and shall ever spring",JF
"Whilest there are pipes, or jolly Shepherds sing.",JF
"And here will I in honour of thy love,",JF
"Dwell by thy Grave, forgeting all those joys,",JF
"That former times made precious to mine eyes,",JF
Only remembring what my youth did gain,JF
"In the dark, hidden vertuous use of Herbs:",JF
"That will I practise, and as freely give",JF
"All my endeavours, as I gain'd them free.",JF
Of all green wounds I know the remedies,JF
"In Men or Cattel, be they stung with Snakes,",JF
"Or charm'd with powerful words of wicked Art,",JF
"Or be they Love-sick, or through too much heat",JF
"Grown wild or Lunatick, their eyes or ears",JF
"Thickned with misty filme of dulling Rheum,",JF
"These I can Cure, such secret vertue lies",JF
In Herbs applyed by a Virgins hand:,JF
"My meat shall be what these wild woods afford,",JF
"Berries, and Chesnuts, Plantanes, on whose Cheeks,",JF
"The Sun sits smiling, and the lofty fruit",JF
Pull'd from the fair head of the staight grown Pine;,JF
"On these I'le feed with free content and rest,",JF
"When night shall blind the world, by thy side blest.",JF
_Enter a_ Satyr.,JF
_Satyr._ Through yon same bending plain,JF
"That flings his arms down to the main,",JF
"And through these thick woods have I run,",JF
Whose bottom never kist the Sun,JF
"Since the lusty Spring began,",JF
"All to please my master _Pan,_",JF
Have I trotted without rest,JF
To get him Fruit; for at a Feast,JF
He entertains this coming night,JF
"His Paramour, the _Syrinx_ bright:",JF
But behold a fairer sight!                  [_He stands amazed._,JF
"By that Heavenly form of thine,",JF
"Brightest fair thou art divine,",JF
Sprung from great immortal race,JF
"Of the gods, for in thy face",JF
"Shines more awful Majesty,",JF
Than dull weak mortalitie,JF
"Dare with misty eyes behold,",JF
And live: therefore on this mold,JF
"Lowly do I bend my knee,",JF
In worship of thy Deitie;,JF
"Deign it Goddess from my hand,",JF
To receive what e're this land,JF
From her fertil Womb doth send,JF
Of her choice Fruits: and but lend,JF
"Belief to that the Satyre tells,",JF
"Fairer by the famous wells,",JF
"To this present day ne're grew,",JF
Never better nor more true.,JF
Here be Grapes whose lusty bloud,JF
"Is the learned Poets good,",JF
Sweeter yet did never crown,JF
"The head of _Bacchus_, Nuts more brown",JF
Than the Squirrels Teeth that crack them;,JF
Deign O fairest fair to take them.,JF
For these black ey'd _Driope_,JF
"Hath oftentimes commanded me,",JF
With my clasped knee to clime;,JF
See how well the lusty time,JF
"Hath deckt their rising cheeks in red,",JF
"Such as on your lips is spred,",JF
"Here be Berries for a Queen,",JF
"Some be red, some be green,",JF
"These are of that luscious meat,",JF
The great God _Pan_ himself doth eat:,JF
"All these, and what the woods can yield,",JF
"The hanging mountain or the field,",JF
"I freely offer, and ere long",JF
"Will bring you more, more sweet and strong,",JF
"Till when humbly leave I take,",JF
"Lest the great _Pan_ do awake,",JF
"That sleeping lies in a deep glade,",JF
"Under a broad Beeches shade,",JF
"I must go, I must run",JF
Swifter than the fiery Sun.                         [_Exit_.,JF
_Clo_. And all my fears go with thee.,JF
"What greatness or what private hidden power,",JF
Is there in me to draw submission,JF
"From this rude man, and beast? sure I am mortal:",JF
"The Daughter of a Shepherd, he was mortal:",JF
And she that bore me mortal: prick my hand,JF
"And it will bleed: a Feaver shakes me,",JF
"And the self same wind that makes the young Lambs shrink,",JF
Makes me a cold: my fear says I am mortal:,JF
Yet I have heard (my Mother told it me),JF
"And now I do believe it, if I keep",JF
"My Virgin Flower uncropt, pure, chaste, and fair,",JF
"No Goblin, Wood-god, Fairy, Elfe, or Fiend,",JF
"Satyr or other power that haunts the Groves,",JF
"Shall hurt my body, or by vain illusion",JF
Draw me to wander after idle fires;,JF
"Or voyces calling me in dead of night,",JF
"To make me follow, and so tole me on",JF
"Through mire and standing pools, to find my ruine:",JF
"Else why should this rough thing, who never knew",JF
"Manners, nor smooth humanity, whose heats",JF
"Are rougher than himself, and more mishapen,",JF
Thus mildly kneel to me? sure there is a power,JF
"In that great name of Virgin, that binds fast",JF
"All rude uncivil bloods, all appetites",JF
That break their confines: then strong Chastity,JF
"Be thou my strongest guard, for here I'le dwell",JF
In opposition against Fate and Hell.,JF
"_Enter an old_ Shepherd, _with him four couple of_ Shepherds",JF
_and_ Shepherdesses.,JF
_Old Shep_. Now we have done this holy Festival,JF
"In honour of our great God, and his rites",JF
"Perform'd, prepare your selves for chaste",JF
"And uncorrupted fires: that as the Priest,",JF
With powerful hand shall sprinkle on [your] Brows,JF
"His pure and holy water, ye may be",JF
"From all hot flames of lust, and loose thoughts free.",JF
"Kneel Shepherds, kneel, here comes the Priest of _Pan_.",JF
_Enter_ Priest.,JF
"_Priest_. Shepherds, thus I purge away,",JF
"Whatsoever this great day,",JF
"Or the past hours gave not good,",JF
To corrupt your Maiden blood:,JF
From the high rebellious heat,JF
"Of the Grapes, and strength of meat;",JF
"From the wanton quick desires,",JF
"They do kindle by their fires,",JF
"I do wash you with this water,",JF
Be you pure and fair hereafter.,JF
"From your Liver and your Veins,",JF
Thus I take away the stains.,JF
"All your thoughts be smooth and fair,",JF
Be ye fresh and free as Air.,JF
Never more let lustful heat,JF
"Through your purged conduits beat,",JF
"Or a plighted troth be broken,",JF
Or a wanton verse be spoken,JF
In a Shepherdesses ear;,JF
"Go your wayes, ye are all clear.",JF
[_They rise and sing in praise of_ Pan.,JF
The SONG.,JF
_Sing his praises that doth keep,JF
"Our Flocks from harm,_",JF
"Pan _the Father of our Sheep,",JF
And arm in arm,JF
"Tread we softly in a round,",JF
Whilest the hollow neighbouring ground,JF
Fills the Musick with her sound._,JF
"Pan, _O great God_ Pan, _to thee",JF
Thus do we sing:,JF
Thou that keep'st us chaste and free,JF
"As the young spring,",JF
"Ever be thy honour spoke,",JF
"From that place the morn is broke,",JF
To that place Day doth unyoke._,JF
[_Exeunt omnes but_ Perigot _and_ Amoret.,JF
"_Peri_. Stay gentle _Amoret_, thou fair brow'd Maid,",JF
"Thy Shepherd prays thee stay, that holds thee dear,",JF
Equal with his souls good.,JF
_Amo_. Speak; I give,JF
"Thee freedom Shepherd, and thy tongue be still",JF
"The same it ever was; as free from ill,",JF
As he whose conversation never knew,JF
The Court or City be thou ever true.,JF
"_Peri_. When I fall off from my affection,",JF
"Or mingle my clean thoughts with foul desires,",JF
"First let our great God cease to keep my flocks,",JF
"That being left alone without a guard,",JF
"The Wolf, or Winters rage, Summers great heat,",JF
"And want of Water, Rots; or what to us",JF
"Of ill is yet unknown, full speedily,",JF
And in their general ruine let me feel.,JF
"_Amo_. I pray thee gentle Shepherd wish not so,",JF
I do believe thee: 'tis as hard for me,JF
"To think thee false, and harder than for thee",JF
To hold me foul.,JF
_Peri_. O you are fairer far,JF
"Than the chaste blushing morn, or that fair star",JF
"That guides the wandring Sea-men through the deep,",JF
Straighter than straightest Pine upon the steep,JF
"Head of an aged mountain, and more white",JF
Than the new Milk we strip before day-light,JF
From the full fraighted bags of our fair flocks:,JF
Your hair more beauteous than those hanging locks,JF
Of young _Apollo_.,JF
"_Amo_. Shepherd be not lost,",JF
Y'are sail'd too far already from the Coast,JF
Of our discourse.,JF
_Peri_. Did you not tell me once,JF
"I should not love alone, I should not lose",JF
"Those many passions, vows, and holy Oaths,",JF
"I've sent to Heaven? did you not give your hand,",JF
Even that fair hand in hostage? Do not then,JF
"Give back again those sweets to other men,",JF
You your self vow'd were mine.,JF
"_Amo_. Shepherd, so far as Maidens modesty",JF
"May give assurance, I am once more thine,",JF
Once more I give my hand; be ever free,JF
"From that great foe to faith, foul jealousie.",JF
"_Peri_. I take it as my best good, and desire",JF
"For stronger confirmation of our love,",JF
"To meet this happy night in that fair Grove,",JF
Where all true Shepherds have rewarded been,JF
"For their long service: say sweet, shall it hold?",JF
"_Amo_. Dear friend, you must not blame me if I make",JF
"A doubt of what the silent night may do,",JF
Coupled with this dayes heat to move your bloud:,JF
Maids must be fearful; sure you have not been,JF
Wash'd white enough; for yet I see a stain,JF
"Stick in your Liver, go and purge again.",JF
"_Peri_. O do not wrong my honest simple truth,",JF
My self and my affections are as pure,JF
As those chaste flames that burn before the shrine,JF
Of the great _Dian_: only my intent,JF
"To draw you thither, was to plight our troths,",JF
"With enterchange of mutual chaste embraces,",JF
And ceremonious tying of our selves:,JF
For to that holy wood is consecrate,JF
"A vertuous well, about whose flowry banks,",JF
"The nimble-footed Fairies dance their rounds,",JF
"By the pale moon-shine, dipping oftentimes",JF
"Their stolen Children, so to make them free",JF
"From dying flesh, and dull mortalitie;",JF
"By this fair Fount hath many a Shepherd sworn,",JF
"And given away his freedom, many a troth",JF
"Been plight, which neither envy, nor old time",JF
"Could ever break, with many a chaste kiss given,",JF
In hope of coming happiness; by this,JF
Fresh Fountain many a blushing Maid,JF
Hath crown'd the head of her long loved Shepherd,JF
"With gaudy flowers, whilest he happy sung",JF
Layes of his love and dear Captivitie;,JF
There grows all Herbs fit to cool looser flames,JF
"Our sensual parts provoke, chiding our bloods,",JF
And quenching by their power those hidden sparks,JF
"That else would break out, and provoke our sense",JF
"To open fires, so vertuous is that place:",JF
"Then gentle Shepherdess, believe and grant,",JF
In troth it fits not with that face to scant,JF
Your faithful Shepherd of those chaste desires,JF
"He ever aim'd at, and--",JF
"_Amo_. Thou hast prevail'd, farewel, this coming night",JF
Shall crown thy chast hopes with long wish'd delight.,JF
_Peri_. Our great god _Pan_ reward thee for that good,JF
Thou hast given thy poor Shepherd: fairest Bud,JF
"Of Maiden Vertues, when I leave to be",JF
"The true Admirer of thy Chastitie,",JF
Let me deserve the hot polluted Name,JF
"Of the wild Woodman, or affect: some Dame,",JF
Whose often Prostitution hath begot,JF
"More foul Diseases, than ever yet the hot",JF
"Sun bred through his burnings, whilst the Dog",JF
"Pursues the raging Lion, throwing Fog,",JF
"And deadly Vapour from his angry Breath,",JF
Filling the lower World with Plague and Death.     [_Ex._ Am.,JF
_Enter_ Amaryllis.,JF
"_Ama_. Shepherd, may I desire to be believ'd,",JF
What I shall blushing tell?,JF
"_Peri_. Fair Maid, you may.",JF
"_Am_. Then softly thus, I love thee, _Perigot_,",JF
"And would be gladder to be lov'd again,",JF
Than the cold Earth is in his frozen arms,JF
"To clip the wanton Spring: nay do not start,",JF
"Nor wonder that I woo thee, thou that art",JF
"The prime of our young Grooms, even the top",JF
Of all our lusty Shepherds! what dull eye,JF
"That never was acquainted with desire,",JF
"Hath seen thee wrastle, run, or cast the Stone",JF
"With nimble strength and fair delivery,",JF
"And hath not sparkled fire, and speedily",JF
Sent secret heat to all the neighbouring Veins?,JF
"Who ever heard thee sing, that brought again",JF
"That freedom back, was lent unto thy Voice;",JF
Then do not blame me (Shepherd) if I be,JF
"One to be numbred in this Companie,",JF
"Since none that ever saw thee yet, were free.",JF
"_Peri_. Fair Shepherdess, much pity I can lend",JF
To your Complaints: but sure I shall not love:,JF
"All that is mine, my self, and my best hopes",JF
Are given already; do not love him then,JF
That cannot love again: on other men,JF
"Bestow those heats more free, that may return",JF
"You fire for fire, and in one flame equal burn.",JF
_Ama_. Shall I rewarded be so slenderly,JF
"For my affection, most unkind of men!",JF
"If I were old, or had agreed with Art",JF
"To give another Nature to my Cheeks,",JF
Or were I common Mistress to the love,JF
"Of every Swain, or could I with such ease",JF
"Call back my Love, as many a Wanton doth;",JF
"Thou might'st refuse me, Shepherd; but to thee",JF
"I am only fixt and set, let it not be",JF
"A Sport, thou gentle Shepherd to abuse",JF
The love of silly Maid.,JF
"_Peri_. Fair Soul, ye use",JF
"These words to little end: for know, I may",JF
"Better call back that time was Yesterday,",JF
"Or stay the coming Night, than bring my Love",JF
"Home to my self again, or recreant prove.",JF
"I will no longer hold you with delays,",JF
This present night I have appointed been,JF
To meet that chaste Fair (that enjoys my Soul),JF
"In yonder Grove, there to make up our Loves.",JF
"Be not deceiv'd no longer, chuse again,",JF
"These neighbouring Plains have many a comely Swain,",JF
"Fresher, and freer far than I e'r was,",JF
"Bestow that love on them, and let me pass.",JF
"Farewel, be happy in a better Choice.               [_Exit_.",JF
"_Ama_. Cruel, thou hast struck me deader with thy Voice",JF
Than if the angry Heavens with their quick flames,JF
"Had shot me through: I must not leave to love,",JF
"I cannot, no I must enjoy thee, Boy,",JF
Though the great dangers 'twixt my hopes and that,JF
Be infinite: there is a Shepherd dwells,JF
"Down by the Moor, whose life hath ever shown",JF
"More sullen Discontent than _Saturns_ Brow,",JF
When he sits frowning on the Births of Men:,JF
One that doth wear himself away in loneness;,JF
And never joys unless it be in breaking,JF
The holy plighted troths of mutual Souls:,JF
"One that lusts after [every] several Beauty,",JF
"But never yet was known to love or like,",JF
"Were the face fairer, or more full of truth,",JF
"Than _Phoebe_ in her fulness, or the youth",JF
Of smooth _Lyaeus_; whose nigh starved flocks,JF
"Are always scabby, and infect all Sheep",JF
"They feed withal; whose Lambs are ever last,",JF
"And dye before their waining, and whose Dog",JF
"Looks like his Master, lean, and full of scurf,",JF
Not caring for the Pipe or Whistle: this man may,JF
"(If he be well wrought) do a deed of wonder,",JF
Forcing me passage to my long desires:,JF
"And here he comes, as fitly to my purpose,",JF
As my quick thoughts could wish for.,JF
_Enter_ Shepherd.,JF
"_Shep_. Fresh Beauty, let me not be thought uncivil,",JF
Thus to be Partner of your loneness: 'twas,JF
My Love (that ever working passion) drew,JF
Me to this place to seek some remedy,JF
"For my sick Soul: be not unkind and fair,",JF
For such the mighty Cupid in his doom,JF
Hath sworn to be aveng'd on; then give room,JF
"To my consuming Fires, that so I may",JF
"Enjoy my long Desires, and so allay",JF
Those flames that else would burn my life away.,JF
"_Ama_. Shepherd, were I but sure thy heart were sound",JF
"As thy words seem to be, means might be found",JF
To cure thee of thy long pains; for to me,JF
That heavy youth-consuming Miserie,JF
"The love-sick Soul endures, never was pleasing;",JF
I could be well content with the quick easing,JF
"Of thee, and thy hot fires, might it procure",JF
Thy faith and farther service to be sure.,JF
"_Shep_. Name but that great work, danger, or what can",JF
"Be compass'd by the Wit or Art of Man,",JF
"And if I fail in my performance, may",JF
I never more kneel to the rising Day.,JF
"_Ama_. Then thus I try thee, Shepherd, this same night,",JF
"That now comes stealing on, a gentle pair",JF
"Have promis'd equal Love, and do appoint",JF
To make yon Wood the place where hands and hearts,JF
Are to be ty'd for ever: break their meeting,JF
"And their strong Faith, and I am ever thine.",JF
"_Shep_. Tell me their Names, and if I do not move",JF
(By my great power) the Centre of their Love,JF
"From his fixt being, let me never more",JF
Warm me by those fair Eyes I thus adore.,JF
"_Ama_. Come, as we go, I'll tell thee what they are,",JF
And give thee fit directions for thy work.           [_Exeunt._,JF
_Enter_ Cloe.,JF
"_Cloe_. How have I wrong'd the times, or men, that thus",JF
After this holy Feast I pass unknown,JF
And unsaluted? 'twas not wont to be,JF
Thus frozen with the younger companie,JF
"Of jolly Shepherds; 'twas not then held good,",JF
For lusty Grooms to mix their quicker blood,JF
"With that dull humour, most unfit to be",JF
"The friend of man, cold and dull Chastitie.",JF
"Sure I am held not fair, or am too old,",JF
"Or else not free enough, or from my fold",JF
"Drive not a flock sufficient great, to gain",JF
The greedy eyes of wealth-alluring Swain:,JF
"Yet if I may believe what others say,",JF
My face has soil enough; nor can they lay,JF
Justly too strict a Coyness to my Charge;,JF
"My Flocks are many, and the Downs as large",JF
They feed upon: then let it ever be,JF
"Their Coldness, not my Virgin Modestie",JF
Makes me complain.,JF
_Enter_ Thenot.,JF
_The_. Was ever Man but I,JF
Thus truly taken with uncertainty?,JF
Where shall that Man be found that loves a mind,JF
"Made up in Constancy, and dare not find",JF
His Love rewarded? here let all men know,JF
A Wretch that lives to love his Mistress so.,JF
"_Clo_. Shepherd, I pray thee stay, where hast thou been?",JF
Or whither go'st thou? here be Woods as green,JF
"As any, air likewise as fresh and sweet,",JF
As where smooth _Zephyrus_ plays on the fleet,JF
"Face of the curled Streams, with Flowers as many",JF
"As the young Spring gives, and as choise as any;",JF
"Here be all new Delights, cool Streams and Wells,",JF
"Arbors o'rgrown with Woodbinds, Caves, and Dells,",JF
"Chase where thou wilt, whilst I sit by, and sing,",JF
Or gather Rushes to make many a Ring,JF
"For thy long fingers; tell thee tales of Love,",JF
"How the pale _Phoebe_ hunting in a Grove,",JF
"First saw the Boy _Endymion_, from whose Eyes",JF
She took eternal fire that never dyes;,JF
"How she convey'd him softly in a sleep,",JF
His temples bound with poppy to the steep,JF
"Head of old _Latmus_, where she stoops each night,",JF
"Gilding the Mountain with her Brothers light,",JF
To kiss her sweetest.,JF
_The_. Far from me are these,JF
"Hot flashes, bred from wanton heat and ease;",JF
I have forgot what love and loving meant:,JF
"Rhimes, Songs, and merry Rounds, that oft are sent",JF
"To the soft Ears of Maids, are strange to me;",JF
"Only I live t' admire a Chastitie,",JF
"That neither pleasing Age, smooth tongue, or Gold,",JF
"Could ever break upon, so pure a Mold",JF
Is that her Mind was cast in; 'tis to her,JF
I only am reserv'd; she is my form I stir,JF
"By, breath and move, 'tis she and only she",JF
"Can make me happy, or give miserie.",JF
"_Clo_. Good Shepherd, may a Stranger crave to know",JF
To whom this dear observance you do ow?,JF
"_The_. You may, and by her Vertue learn to square",JF
And level out your Life; for to be fair,JF
"And nothing vertuous, only fits the Eye",JF
"Of gaudy Youth, and swelling Vanitie.",JF
"Then know, she's call'd the Virgin of the Grove,",JF
"She that hath long since bury'd her chaste Love,",JF
"And now lives by his Grave, for whose dear Soul",JF
She hath vow'd her self into the holy Roll,JF
"Of strict Virginity; 'tis her I so admire,",JF
"Not any looser Blood, or new desire.",JF
"_Clo_. Farewel poor Swain, thou art not for my bend,",JF
"I must have quicker Souls, whose works may tend",JF
To some free action: give me him dare love,JF
"At first encounter, and as soon dare prove.",JF
The SONG.,JF
"_Come Shepherds, come,",JF
Come away without delay,JF
Whilst the gentle time dot[h] stay.,JF
"Green Woods are dumb,",JF
And will never tell to any,JF
"Those dear Kisses, and those many",JF
Sweet Embraces that are given,JF
Dainty Pleasures that would even,JF
"Raise in coldest Age a fire,",JF
"And give Virgin Blood desire,",JF
"Then if ever,",JF
"Now or never,",JF
"Come and have it,",JF
"Think not I,",JF
"Dare deny,",JF
If you crave it._,JF
_Enter_ Daphnis.,JF
"Here comes another: better be my speed,",JF
"Thou god of Blood: but certain, if I read",JF
"Not false, this is that modest Shepherd, he",JF
"That only dare salute, but ne'r could be",JF
"Brought to kiss any, hold discourse, or sing,",JF
"Whisper, or boldly ask that wished thing",JF
"We all are born for; one that makes loving Faces,",JF
"And could be well content to covet Graces,",JF
Were they not got by boldness; in this thing,JF
My hopes are frozen; and but Fate doth bring,JF
"Him hither, I would sooner chuse",JF
"A Man made out of Snow, and freer use",JF
"An Eunuch to my ends: but since he's here,",JF
"Thus I attempt him. Thou of men most dear,",JF
"Welcome to her, that only for thy sake,",JF
Hath been content to live: here boldly take,JF
"My hand in pledg, this hand, that never yet",JF
Was given away to any: and but sit,JF
"Down on this rushy Bank, whilst I go pull",JF
"Fresh Blossoms from the Boughs, or quickly cull",JF
"The choicest delicates from yonder Mead,",JF
"To make thee Chains, or Chaplets, or to spread",JF
"Under our fainting Bodies, when delight",JF
Shall lock up all our senses. How the sight,JF
Of those smooth rising Cheeks renew the story,JF
"Of young _Adonis_, when in Pride and Glory",JF
He lay infolded 'twixt the beating arms,JF
Of willing _Venus_: methinks stronger Charms,JF
"Dwell in those speaking eyes, and on that brow",JF
More sweetness than the Painters can allow,JF
"To their best pieces: not _Narcissus_, he",JF
That wept himself away in memorie,JF
"Of his own Beauty, nor _Silvanus_ Boy,",JF
"Nor the twice ravish'd Maid, for whom old _Troy_",JF
"Fell by the hand of _Pirrhus_, may to thee",JF
"Be otherwise compar'd, than some dead Tree",JF
To a young fruitful Olive.,JF
"_Daph_. I can love,",JF
"But I am loth to say so, lest I prove",JF
Too soon unhappy.,JF
"_Clo_. Happy thou would'st say,",JF
"My dearest _Daphnis_, blush not, if the day",JF
"To thee and thy soft heats be enemie,",JF
"Then take the coming Night, fair youth 'tis free",JF
"To all the World, Shepherd, I'll meet thee then",JF
"When darkness hath shut up the eyes of men,",JF
"In yonder Grove: speak, shall our Meeting hold?",JF
"Indeed you are too bashful, be more bold,",JF
And tell me I.,JF
"_Daph_. I'm content to say so,",JF
"And would be glad to meet, might I but pray so",JF
"Much from your Fairness, that you would be true.",JF
"_Clo_. Shepherd, thou hast thy Wish.",JF
"_Daph_. Fresh Maid, adieu:",JF
"Yet one word more, since you have drawn me on",JF
"To come this Night, fear not to meet alone",JF
"That man that will not offer to be ill,",JF
"Though your bright self would ask it, for his fill",JF
"Of this Worlds goodness: do not fear him then,",JF
But keep your 'pointed time; let other men,JF
"Set up their Bloods to sale, mine shall be ever",JF
"Fair as the Soul it carries, and unchast never.       [_Exit_.",JF
_Clo_. Yet am I poorer than I was before.,JF
"Is it not strange, among so many a score",JF
"Of lusty Bloods, I should pick out these things",JF
"Whose Veins like a dull River far from Springs,",JF
"Is still the same, slow, heavy, and unfit",JF
"For stream or motion, though the strong winds hit",JF
With their continual power upon his sides?,JF
"O happy be your names that have been brides,",JF
And tasted those rare sweets for which I pine:,JF
"And far more heavy be thy grief and time,",JF
"Thou lazie swain, that maist relieve my needs,",JF
"Than his, upon whose liver alwayes feeds",JF
A hungry vultur.,JF
_Enter_ Alexis.,JF
_Ale_. Can such beauty be,JF
"Safe in his own guard, and not draw the eye",JF
"Of him that passeth on, to greedy gaze,",JF
"Or covetous desire, whilst in a maze",JF
"The better part contemplates, giving rein",JF
And wished freedom to the labouring vein?,JF
"Fairest and whitest, may I crave to know",JF
"The cause of your retirement, why ye goe",JF
"Thus all alone? methinks the downs are sweeter,",JF
"And the young company of swains far meeter,",JF
Than those forsaken and untroden places.,JF
"Give not your self to loneness, and those graces",JF
