line,au_code
"The vein grow whiter; then repent, and pray",JF
"Great _Pan_ to keep you from the like decay,",JF
And I shall undertake your cure with ease.,JF
Till when this vertuous Plaster will displease,JF
Your tender sides; give me your hand and rise:,JF
"Help him a little _Satyr_, for his thighs",JF
Yet are feeble.,JF
_Alex._ Sure I have lost much blood.,JF
"_Satyr._ 'Tis no matter, 'twas not good.",JF
"Mortal you must leave your wooing,",JF
"Though there be a joy in doing,",JF
"Yet it brings much grief behind it,",JF
"They best feel it, that do find it.",JF
"_Clor._ Come bring him in, I will attend his sore",JF
"When you are well, take heed you lust no more.",JF
"_Satyr._ Shepherd, see what comes of kissing,",JF
By my head 'twere better missing.,JF
"Brightest, if there be remaining",JF
"Any service, without feigning",JF
I will do it; were I set,JF
"To catch the nimble wind, or get",JF
"Shadows gliding on the green,",JF
Or to steal from the great Queen,JF
"Of _Fayries_, all her beauty,",JF
"I would do it, so much duty",JF
Do I owe those precious Eyes.,JF
"_Clor._ I thank thee honest _Satyr_, if the cryes",JF
"Of any other that be hurt or ill,",JF
"Draw thee unto them, prithee do thy will",JF
To bring them hither.,JF
"_Satyr._ I will, and when the weather",JF
"Serves to Angle in the brook,",JF
"I will bring a silver hook,",JF
"With a line of finest silk,",JF
"And a rod as white as milk,",JF
To deceive the little fish:,JF
"So I take my leave, and wish,",JF
On this Bower may ever dwell,JF
"Spring, and Summer.",JF
_Clo_. Friend farewel.                      [_Exit_.,JF
"_Enter_ Amoret, _seeking her Love_.",JF
"_Amor_. This place is Ominous, for here I lost",JF
"My Love and almost life, and since have crost",JF
"All these Woods over, never a Nook or Dell,",JF
"Where any little Bird, or Beast doth dwell,",JF
"But I have sought him, never a bending brow",JF
"Of any Hill or Glade, the wind sings through,",JF
"Nor a green bank, nor shade where Shepherds use",JF
"To sit and Riddle, sweetly pipe, or chuse",JF
"Their Valentines, that I have mist, to find",JF
"My love in. _Perigot_, Oh too unkind,",JF
Why hast thou fled me? whither art thou gone?,JF
How have I wrong'd thee? was my love alone,JF
"To thee worthy this scorn'd recompence? 'tis well,",JF
I am content to feel it: but I tell,JF
"Thee Shepherd, and these lusty woods shall hear,",JF
Forsaken _Amoret_ is yet as clear,JF
"Of any stranger fire, as Heaven is",JF
"From foul corruption, or the deep Abysse",JF
From light and happiness; and thou mayst know,JF
"All this for truth, and how that fatal blow",JF
"Thou gav'st me, never from desert of mine,",JF
"Fell on my life, but from suspect of thine,",JF
"Or fury more than madness; therefore, here,",JF
"Since I have lost my life, my love, my dear,",JF
"Upon this cursed place, and on this green,",JF
"That first divorc'd us, shortly shall be seen",JF
"A sight of so great pity, that each eye",JF
Shall dayly spend his spring in memory,JF
Of my untimely fall.,JF
_Enter_ Amaryllis.,JF
"_Amar_. I am not blind,",JF
"Nor is it through the working of my mind,",JF
That this shows _Amoret_; forsake me all,JF
"That dwell upon the soul, but what men call",JF
"Wonder, or more than wonder, miracle,",JF
For sure so strange as this the Oracle,JF
"Never gave answer of, it passeth dreams,",JF
"Or mad-mens fancy, when the many streams",JF
Of new imaginations rise and fall:,JF
Tis but an hour since these Ears heard her call,JF
"For pity to young _Perigot_; whilest he,",JF
Directed by his fury bloodily,JF
"Lanc't up her brest, which bloodless fell and cold;",JF
"And if belief may credit what was told,",JF
"After all this, the Melancholy Swain",JF
"Took her into his arms being almost slain,",JF
And to the bottom of the holy well,JF
"Flung her, for ever with the waves to dwell.",JF
"Tis she, the very same, 'tis _Amoret_,",JF
"And living yet, the great powers will not let",JF
"Their vertuous love be crost. Maid, wipe away",JF
"Those heavy drops of sorrow, and allay",JF
"The storm that yet goes high, which not deprest,",JF
"Breaks heart and life, and all before it rest:",JF
Thy _Perigot_--,JF
"_Amor_. Where, which is _Perigot?_",JF
"_Amar_. Sits there below, lamenting much, god wot,",JF
"Thee [and thy] fortune, go and comfort him,",JF
And thou shalt find him underneath a brim,JF
Of sailing Pines that edge yon Mountain in.,JF
"_Amo_. I go, I run, Heaven grant me I may win",JF
His soul again.                               [_Exit_ Amoret.,JF
_Enter_ Sullen.,JF
"_Sull_. Stay _Amaryllis_, stay,",JF
"Ye are too fleet, 'tis two hours yet to day.",JF
"I have perform'd my promise, let us sit",JF
And warm our bloods together till the fit,JF
Come lively on us.,JF
"_Amar_. Friend you are too keen,",JF
"The morning riseth and we shall be seen,",JF
Forbear a little.,JF
_Sull_. I can stay no longer.,JF
"_Amar_. Hold _Shepherd_ hold, learn not to be a wronger",JF
"Of your word, was not your promise laid,",JF
To break their loves first?,JF
_Sull_. I have done it Maid.,JF
"_Amar_. No, they are yet unbroken, met again,",JF
And are as hard to part yet as the stain,JF
Is from the finest Lawn.,JF
_Sull_. I say they are,JF
"Now at this present parted, and so far,",JF
That they shall never meet.,JF
"_Amar_. Swain 'tis not so,",JF
"For do but to yon hanging Mountain go,",JF
And there believe your eyes.,JF
_Sull_. You do but hold,JF
Off with delayes and trifles; farewell cold,JF
"And frozen bashfulness, unfit for men;",JF
Thus I salute thee Virgin.,JF
"_Amar_. And thus then,",JF
"I bid you follow, catch me if you can.             [_Exit_.",JF
_Sull_. And if I stay behind I am no man.     [_Exit running after her_.,JF
_Enter_ Perigot.,JF
_Per_. Night do not steal away: I woo thee yet,JF
To hold a hard hand o're the rusty bit,JF
"That guides the lazy Team: go back again,",JF
"_Bootes_, thou that driv'st thy frozen Wain",JF
"Round as a Ring, and bring a second Night",JF
To hide my sorrows from the coming light;,JF
"Let not the eyes of men stare on my face,",JF
"And read my falling, give me some black place",JF
"Where never Sun-beam shot his wholesome light,",JF
That I may sit and pour out my sad spright,JF
"Like running water, never to be known",JF
After the forced fall and sound is gone.,JF
_Enter_ Amoret _looking for_ Perigot.,JF
"_Amo_. This is the bottom: speak if thou be here,",JF
"My _Perigot_, thy _Amoret_, thy dear",JF
Calls on thy loved Name.,JF
_Per_. What art thou [dare],JF
"Tread these forbidden paths, where death and care",JF
Dwell on the face of darkness?,JF
"_Amo_. 'Tis thy friend,",JF
"Thy _Amoret_, come hither to give end",JF
"To these consumings; look up gentle Boy,",JF
I have forgot those Pains and dear annoy,JF
"I suffer'd for thy sake, and am content",JF
To be thy love again; why hast thou rent,JF
"Those curled locks, where I have often hung",JF
"Riband and Damask-roses, and have flung",JF
"Waters distil'd to make thee fresh and gay,",JF
Sweeter than the Nosegayes on a Bridal day?,JF
"Why dost thou cross thine Arms, and hang thy face",JF
"Down to thy bosom, letting fall apace",JF
From those two little Heavens upon the ground,JF
"Showers of more price, more Orient, and more round",JF
Than those that hang upon the Moons pale brow?,JF
"Cease these complainings, Shepherd, I am now",JF
"The same I ever was, as kind and free,",JF
And can forgive before you ask of me.,JF
Indeed I can and will.,JF
_Per_. So spoke my fair.,JF
"O you great working powers of Earth and Air,",JF
"Water and forming fire, why have you lent",JF
Your hidden vertues of so ill intent?,JF
"Even such a face, so fair, so bright of hue",JF
"Had _Amoret_; such words so smooth and new,",JF
"Came flying from her tongue; such was her eye,",JF
And such the pointed sparkle that did flye,JF
"Forth like a bleeding shaft; all is the same,",JF
"The Robe and Buskins, painted Hook, and frame",JF
"Of all her Body. O me, _Amoret_!",JF
"_Amo_. Shepherd, what means this Riddle? who hath set",JF
So strong a difference 'twixt my self and me,JF
That I am grown another? look and see,JF
"The Ring thou gav'st me, and about my wrist",JF
That curious Bracelet thou thy self didst twist,JF
From those fair Tresses: knowst thou _Amoret_?,JF
Hath not some newer love forc'd thee forget,JF
Thy Ancient faith?,JF
_Per_. Still nearer to my love;,JF
These be the very words she oft did prove,JF
"Upon my temper, so she still would take",JF
"Wonder into her face, and silent make",JF
"Signs with her head and hand, as who would say,",JF
Shepherd remember this another day.,JF
_Amo_. Am I not _Amaret_? where was I lost?,JF
"Can there be Heaven, and time, and men, and most",JF
Of these unconstant? Faith where art thou fled?,JF
"Are all the vows and protestations dead,",JF
"The hands [held] up, the wishes, and the heart,",JF
"Is there not one remaining, not a part",JF
Of all these to be found? why then I see,JF
Men never knew that vertue Constancie.,JF
"_Per_. Men ever were most blessed, till crass fate",JF
"Brought Love and Women forth, unfortunate",JF
"To all that ever tasted of their smiles,",JF
"Whose actions are all double, full of wiles:",JF
"Like to the subtil Hare, that 'fore the Hounds",JF
"Makes many turnings, leaps and many rounds,",JF
"This way and that way, to deceive the scent",JF
Of her pursuers.,JF
_Amo_. 'Tis but to prevent,JF
"Their speedy coming on that seek her fall,",JF
"The hands of cruel men, more Bestial,",JF
And of a nature more refusing good,JF
"Than Beasts themselves, or Fishes of the Flood.",JF
"_Per_. Thou art all these, and more than nature meant,",JF
"When she created all, frowns, joys, content;",JF
"Extream fire for an hour, and presently",JF
"Colder than sleepy poyson, or the Sea,",JF
Upon whose face sits a continual frost:,JF
"Your actions ever driven to the most,",JF
"Then down again as low, that none can find",JF
The rise or falling of a Womans mind.,JF
"_Amo_. Can there be any Age, or dayes, or time,",JF
"Or tongues of men, guilty so great a crime",JF
"As wronging simple Maid? O _Perigot_,",JF
"Thou that wast yesterday without a blot,",JF
"Thou that wast every good, and every thing",JF
That men call blessed; thou that wast the spring,JF
From whence our looser grooms drew all their best;,JF
"Thou that wast alwayes just, and alwayes blest",JF
In faith and promise; thou that hadst the name,JF
"Of Vertuous given thee, and made good the same",JF
Ev'en from thy Cradle; thou that wast that all,JF
That men delighted in; Oh what a fall,JF
"Is this, to have been so, and now to be",JF
"The only best in wrong and infamie,",JF
And I to live to know this! and by me,JF
"That lov'd thee dearer than mine eyes, or that",JF
"Which we esteem'd our honour, Virgin state;",JF
"Dearer than Swallows love the early morn,",JF
Or Dogs of Chace the sound of merry Horn;,JF
"Dearer than thou canst love thy new Love, if thou hast",JF
"Another, and far dearer than the last;",JF
"Dearer than thou canst love thy self, though all",JF
The self love were within thee that did fall,JF
"With that coy Swain that now is made a flower,",JF
"For whose dear sake, Echo weeps many a shower.",JF
And am I thus rewarded for my flame?,JF
Lov'd worthily to get a wantons name?,JF
"Come thou forsaken Willow, wind my head,",JF
And noise it to the world my Love is dead:,JF
"I am forsaken, I am cast away.",JF
"And left for every lazy Groom to say,",JF
"I was unconstant, light, and sooner lost",JF
"Than the quick Clouds we see, or the chill Frost",JF
"When the hot Sun beats on it. Tell me yet,",JF
Canst thou not love again thy _Amoret_?,JF
"_Per_. Thou art not worthy of that blessed name,",JF
"I must not know thee, fling thy wanton flame",JF
"Upon some lighter blood, that may be hot",JF
With words and feigned passions: _Perigot_,JF
"Was ever yet unstain'd, and shall not now",JF
Stoop to the meltings of a borrowed brow.,JF
"_Amo_. Then hear me heaven, to whom I call for right,",JF
And you fair twinkling stars that crown the night;,JF
"And hear me woods, and silence of this place,",JF
And ye sad hours that move a sullen pace;,JF
Hear me ye shadows that delight to dwell,JF
"In horrid darkness, and ye powers of Hell,",JF
"Whilst I breath out my last; I am that maid,",JF
"That yet untainted _Amoret_, that plaid",JF
"The careless prodigal, and gave away",JF
"My soul to this young man, that now dares say",JF
"I am a stranger, not the same, more wild;",JF
And thus with much belief I was beguil'd.,JF
"I am that maid, that have delaid, deny'd,",JF
And almost scorn'd the loves of all that try'd,JF
"To win me, but this swain, and yet confess",JF
I have been woo'd by many with no less,JF
"Soul of affection, and have often had",JF
"Rings, Belts, and Cracknels sent me from the lad",JF
That feeds his flocks down westward; Lambs and Doves,JF
"By young _Alexis; Daphnis_ sent me gloves,",JF
"All which I gave to thee: nor these, nor they",JF
"That sent them did I smile on, or e're lay",JF
Up to my after-memory. But why,JF
"Do I resolve to grieve, and not to dye?",JF
"Happy had been the stroke thou gav'st, if home;",JF
By this time had I found a quiet room,JF
"Where every slave is free, and every brest",JF
"That living breeds new care, now lies at rest,",JF
And thither will poor _Amoret_.,JF
_Per_. Thou must.,JF
Was ever any man so loth to trust,JF
His eyes as I? or was there ever yet,JF
Any so like as this to _Amoret_?,JF
"For whose dear sake, I promise if there be",JF
"A living soul within thee, thus to free",JF
Thy body from it.                     [_He hurts her again_.,JF
"_Amo_. So, this work hath end:",JF
"Farewel and live, be constant to thy friend",JF
That loves thee next.,JF
"_Enter_ Satyr, Perigot _runs off_.",JF
"_Satyr_. See the day begins to break,",JF
And the light shoots like a streak,JF
"Of subtil fire, the wind blows cold,",JF
Whilst the morning doth unfold;,JF
"Now the Birds begin to rouse,",JF
And the Squirril from the boughs,JF
Leaps to get him Nuts and fruit;,JF
"The early Lark that erst was mute,",JF
Carrols to the rising day,JF
Many a note and many a lay:,JF
"Therefore here I end my watch,",JF
Lest the wandring swain should catch,JF
"Harm, or lose himself.",JF
_Amo_. Ah me!,JF
"_Satyr_. Speak again what e're thou be,",JF
"I am ready, speak I say:",JF
"By the dawning of the day,",JF
"By the power of night and _Pan_,",JF
I inforce thee speak again.,JF
_Amo_. O I am most unhappy.,JF
_Satyr_. Yet more blood!,JF
Sure these wanton Swains are wode.,JF
Can there be a hand or heart,JF
Dare commit so vile a part,JF
As this Murther? By the Moon,JF
"That hid her self when this was done,",JF
Never was a sweeter face:,JF
I will bear her to the place,JF
Where my Goddess keeps; and crave,JF
"Her to give her life, or grave.                  [_Exeunt_.",JF
_Enter_ Clorin.,JF
_Clor_. Here whilst one patient takes his rest secure,JF
I steal abroad to doe another Cure.,JF
"Pardon thou buryed body of my love,",JF
"That from thy side I dare so soon remove,",JF
"I will not prove unconstant, nor will leave",JF
Thee for an hour alone. When I deceive,JF
"My first made vow, the wildest of the wood",JF
"Tear me, and o're thy Grave let out my blood;",JF
I goe by wit to cure a lovers pain,JF
"Which no herb can; being done, I'le come again.      [_Exit_.",JF
_Enter_ Thenot.,JF
"_The_. Poor Shepherd in this shade for ever lye,",JF
"And seeing thy fair _Clorins_ Cabin, dye:",JF
"0 hapless love, which [being] answer'd, ends;",JF
And as a little infant cryes and bends,JF
"His tender Brows, when rowling of his eye",JF
He hath espy'd some thing that glisters nigh,JF
"Which he would have, yet give it him, away",JF
"He throws it straight, and cryes afresh to play",JF
"With something else: such my affection, set",JF
"On that which I should loath, if I could get.",JF
_Enter_ Clorin.,JF
_Clor_. See where he lyes; did ever man but he,JF
Love any woman for her Constancie,JF
"To her dead lover, which she needs must end",JF
"Before she can allow him for her friend,",JF
"And he himself must needs the cause destroy,",JF
"For which he loves, before he can enjoy?",JF
"Poor _Shepherd_, Heaven grant I at once may free",JF
"Thee from thy pain, and keep my loyaltie:",JF
"_Shepherd_, look up.",JF
_The_. Thy brightness doth amaze!,JF
"So _Phoebus_ may at noon bid mortals gaze,",JF
"Thy glorious constancie appears so bright,",JF
I dare not meet the Beams with my weak sight.,JF
_Clor_. Why dost thou pine away thy self for me?,JF
_The_. Why dost thou keep such spotless constancie?,JF
"_Clor_. Thou holy _Shepherd_, see what for thy sake",JF
"_Clorin_, thy _Clorin_, now dare under take.         [_He starts up_.",JF
"_The_. Stay there, thou constant _Clorin_, if there be",JF
"Yet any part of woman left in thee,",JF
To make thee light: think yet before thou speak.,JF
_Clor_. See what a holy vow for thee I break.,JF
I that already have my fame far spread,JF
For being constant to my lover dead.,JF
"_The_. Think yet, dear _Clorin_, of your love, how true,",JF
"If you had dyed, he would have been to you.",JF
_Clor_. Yet all I'le lose for thee.,JF
_The_. Think but how blest,JF
A constant woman is above the rest.,JF
"_Clor_. And offer up my self, here on this ground,",JF
To be dispos'd by thee.,JF
_The_. Why dost thou wound,JF
"His heart with malice, against woman more,",JF
"That hated all the Sex, but thee before?",JF
How much more pleasant had it been to me,JF
"To dye, than to behold this change in thee?",JF
"Yet, yet, return, let not the woman sway.",JF
"_Clor_. Insult not on her now, nor use delay,",JF
Who for thy sake hath ventur'd all her fame.,JF
"_The_. Thou hast not ventur'd, but bought certain shame,",JF
"Your Sexes curse, foul falshood must and shall,",JF
"I see, once in your lives, light on you all.",JF
I hate thee now: yet turn.,JF
_Clor_. Be just to me:,JF
Shall I at once both lose my fame and thee?,JF
"_The_. Thou hadst no fame, that which thou didst like good,",JF
Was but thy appetite that sway'd thy blood,JF
For that time to the best: for as a blast,JF
"That through a house comes, usually doth cast",JF
"Things out of order, yet by chance may come,",JF
And blow some one thing to his proper room;,JF
"So did thy appetite, and not thy zeal,",JF
Sway thee [by] chance to doe some one thing well.,JF
Yet turn.,JF
_Clor_. Thou dost but try me if I would,JF
"Forsake thy dear imbraces, for my old",JF
"Love's, though he were alive: but do not fear.",JF
"_The_. I do contemn thee now, and dare come near,",JF
"And gaze upon thee; for me thinks that grace,",JF
"Austeritie, which sate upon that face",JF
"Is gone, and thou like others: false maid see,",JF
This is the gain of foul inconstancie.           [_Exit_.,JF
"_Clor_. 'Tis done, great _Pan_ I give thee thanks for it,",JF
"What art could not have heal'd, is cur'd by wit.",JF
"_Enter_ Thenot, _again_.",JF
_The_. Will ye be constant yet? will ye remove,JF
Into the Cabin to your buried Love?,JF
"_Clor_. No let me die, but by thy side remain.",JF
_The_. There's none shall know that thou didst ever stain,JF
"Thy worthy strictness, but shall honour'd be,",JF
"And I will lye again under this tree,",JF
"And pine and dye for thee with more delight,",JF
Than I have sorrow now to know the light.,JF
"_Clor_. Let me have thee, and I'le be where thou wilt.",JF
"_The_. Thou art of womens race, and full of guilt.",JF
"Farewel all hope of that Sex, whilst I thought",JF
"There was one good, I fear'd to find one naught:",JF
"But since their minds I all alike espie,",JF
"Henceforth I'le choose as others, by mine eye.",JF
"_Clor_. Blest be ye powers that give such quick redress,",JF
And for my labours sent so good success.,JF
"I rather choose, though I a woman be,",JF
"He should speak ill of all, than die for me.",JF
_Actus Quintus. Scena Prima_.,JF
"_Enter_ Priest, _and old_ Shepherd.",JF
"_Priest_. Shepherds, rise and shake off sleep,",JF
See the blushing Morn doth peep,JF
"Through the window, whilst the Sun",JF
"To the mountain tops is run,",JF
Gilding all the Vales below,JF
"With his rising flames, which grow",JF
Greater by his climbing still.,JF
"Up ye lazie grooms, and fill",JF
Bagg and Bottle for the field;,JF
"Clasp your cloaks fast, lest they yield",JF
To the bitter North-east wind.,JF
"Call the Maidens up, and find",JF
"Who lay longest, that she may",JF
Goe without a friend all day;,JF
"Then reward your Dogs, and pray",JF
_Pan_ to keep you from decay:,JF
So unfold and then away.,JF
What not a Shepherd stirring? sure the grooms,JF
"Have found their beds too easie, or the rooms",JF
"Fill'd with such new delight, and heat, that they",JF
"Have both forgot their hungry sheep, and day;",JF
"Knock, that they may remember what a shame",JF
Sloath and neglect layes on a Shepherds name.,JF
"_Old Shep_. It is to little purpose, not a swain",JF
"This night hath known his lodging here, or lain",JF
"Within these cotes: the woods, or some near town,",JF
"That is a neighbour to the bordering Down,",JF
"Hath drawn them thither, 'bout some lustie sport,",JF
"Or spiced Wassel-Boul, to which resort",JF
"All the young men and maids of many a cote,",JF
Whilst the trim Minstrel strikes his merry note.,JF
"_Priest_. God pardon sin, show me the way that leads",JF
To any of their haunts.,JF
"_Old Shep_. This to the meads,",JF
And that down to the woods.,JF
_Priest_. Then this for me;,JF
Come Shepherd let me crave your companie.    [_Exeunt_.,JF
"_Enter_ Clorin, _in her Cabin_, Alexis, _with her_.",JF
"_Clor_. Now your thoughts are almost pure,",JF
And your wound begins to cure:,JF
"Strive to banish all that's vain,",JF
Lest it should break out again.,JF
"_Alex_. Eternal thanks to thee, thou holy maid:",JF
I find my former wandring thoughts well staid,JF
"Through thy wise precepts, and my outward pain",JF
By thy choice herbs is almost gone again:,JF
Thy sexes vice and vertue are reveal'd,JF
"At once, for what one hurt, another heal'd.",JF
"_Clor_. May thy grief more appease,",JF
Relapses are the worst disease.,JF
"Take heed how you in thought offend,",JF
So mind and body both will mend.,JF
"_Enter_ Satyr, _with_ Amoret.",JF
"_Amo_. Beest thou the wildest creature of the wood,",JF
"That bearst me thus away, drown'd in my blood,",JF
"And dying, know I cannot injur'd be,",JF
"I am a maid, let that name fight for me.",JF
_Satyr_. Fairest Virgin do not fear,JF
"Me, that do thy body bear,",JF
"Not to hurt, but heal'd to be;",JF
Men are ruder far than we.,JF
"See fair _Goddess_ in the wood,",JF
They have let out yet more blood.,JF
Some savage man hath struck her breast,JF
"So soft and white, that no wild beast",JF
"Durst ha' toucht asleep, or wake:",JF
"So sweet, that _Adder, Newte_, or _Snake_,",JF
"Would have lain from arm to arm,",JF
On her bosom to be warm,JF
"All a night, and being hot,",JF
Gone away and stung her not.,JF
Quickly clap herbs to her breast;,JF
A man sure is a kind of beast.,JF
"_Clor_. With spotless hand, on spotless brest",JF
I put these herbs to give thee rest:,JF
"Which till it heal thee, will abide,",JF
"If both be pure, if not, off slide.",JF
"See it falls off from the wound,",JF
"Shepherdess thou art not sound,",JF
Full of lust.,JF
"_Satyr_, Who would have thought it,",JF
So fair a face?,JF
_Clor_. Why that hath brought it.,JF
"_Amo_. For ought I know or think, these words, my last:",JF
Yet _Pan_ so help me as my thoughts are chast.,JF
"_Clor_. And so may _Pan_ bless this my cure,",JF
As all my thoughts are just and pure;,JF
"Some uncleanness nigh doth lurk,",JF
That will not let my Medicines work.,JF
_Satyr_ search if thou canst find it.,JF
"_Satyr_. Here away methinks I wind it,",JF
"Stronger yet: Oh here they be,",JF
"Here, here, in a hollow tree,",JF
Two fond mortals have I found.,JF
"_Clor_. Bring them out, they are unsound.",JF
"_Enter_ Cloe, _and_ Daphnis.",JF
"_Satyr_. By the fingers thus I wring ye,",JF
To my _Goddess_ thus I bring ye;,JF
"Strife is vain, come gently in,",JF
"I scented them, they're full of sin.",JF
"_Clor_. Hold _Satyr_, take this Glass,",JF
"Sprinkle over all the place,",JF
"Purge the Air from lustfull breath,",JF
"To save this Shepherdess from death,",JF
And stand you still whilst I do dress,JF
Her wound for fear the pain encrease.,JF
_Sat_. From this glass I throw a drop,JF
Of Crystal water on the top,JF
"Of every grass, on flowers a pair:",JF
Send a fume and keep the air,JF
"Pure and wholsom, sweet and blest,",JF
Till this Virgins wound be drest.,JF
"_Clor. Satyr_, help to bring her in.",JF
"_Sat_. By _Pan_, I think she hath no sin,",JF
She is so light: lye on these leaves.,JF
"Sleep that mortal sense deceives,",JF
"Crown thine Eyes, and ease thy pain,",JF
Maist thou soon be well again.,JF
"_Clor. Satyr_, bring the Shepherd near,",JF
Try him if his mind be clear.,JF
_Sat_. Shepherd come.,JF
_Daph_. My thoughts are pure.,JF
_Sat_. The better trial to endure.,JF
"_Clor_. In this flame his finger thrust,",JF
Which will burn him if he lust;,JF
"But if not, away will turn,",JF
As loth unspotted flesh to burn:,JF
"See, it gives back, let him go,",JF
"Farewel mortal, keep thee so.",JF
"_Sat_. Stay fair _Nymph_, flye not so fast,",JF
We must try if you be chaste:,JF
"Here's a hand that quakes for fear,",JF
Sure she will not prove so clear.,JF
"_Clor._ Hold her finger to the flame,",JF
That will yield her praise or shame.,JF
"_Sat._ To her doom she dares not stand,",JF
"But plucks away her tender hand,",JF
And the Taper darting sends,JF
His hot beams at her fingers ends:,JF
"O thou art foul within, and hast",JF
"A mind, if nothing else, unchaste.",JF
